ID;type;description;nbAns;Answer1;Answer2;Answer3;Answer4;Answer5;Answer6;Answer7;Answer8;Answer9;Answer10;Answer11;Valid1;Valid2;Valid3;Valid4;Valid5;Valid6;Valid7;Valid8;Valid9;Valid10;Valid11
1;SAP;Which of the following generic types can you use to define a field symbol that will be assigned to a character string?;3;Type xsequence;Type any;Type clike;Type any table;Type csequence;NULL;NULL;NULL;NULL;NULL;NULL;0;1;1;0;1;NULL;NULL;NULL;NULL;NULL;NULL
2;SAP;You have created the following:- A class with an event definition- A handler class with a method ON EVT that handles this event- A report that instantiates the handler class-A message statement that raises an exceptionHowever, the report does not react to the event. How do you analyze this issue?;3;Check if the event is triggered by setting a breakpoint at the MESSAGE ... RAISING ... statement.;Check if the handler method ON_EVT is defined in a subroutine of the report.;Check if the event is triggered by setting a breakpoint at the RAISE EVENT statement;Check if the handler method is registered to the correct event.;Check if the implementation of the handler method ON_EVT contains the desired logic.;NULL;NULL;NULL;NULL;NULL;NULL;0;0;1;1;1;NULL;NULL;NULL;NULL;NULL;NULL
3;SAP;Which screen in the ABAP Dictionary allows you to log data changes to the table?;1;Attributes tab;Utilities \x02 Settings;Technical Settings;Delivery and Maintenance tab;Utilities \x02 Database Object \x02 Database Utility;NULL;NULL;NULL;NULL;NULL;NULL;0;0;1;0;0;NULL;NULL;NULL;NULL;NULL;NULL
4;SAP;You want to develop a validation routine for a selection screen field. If a wrong value is entered into the field an error message should be displayed and the focus should move to the field. Which event do you use to achieve this?;1;AT SELECTION-SCREEN;START-OF-SELECTION;INITIALIZATION;END-OF-SELECTION;NULL;NULL;NULL;NULL;NULL;NULL;NULL;1;0;0;0;NULL;NULL;NULL;NULL;NULL;NULL;NULL
5;SAP;Which objects are automatically created when you create a new function group?;1;A function pool and two include programs;A function pool and two function modules;A function pool and two module pools;A function pool and two subroutine pools;NULL;NULL;NULL;NULL;NULL;NULL;NULL;1;0;0;0;NULL;NULL;NULL;NULL;NULL;NULL;NULL
6;SAP;In an ABAP program you have the following code sequence:DATA text TYPE string.DATA Text_ref TYPE REF TO string.DATA data_ref TYPE REF TO data.FIELD-SYMBOLS <fs> TYPE anyText = Content of Data ObjectGET REFERENCE OF text INTO data_ref.Which of the following pieces of code can you use to output the content of variable text?;2;text_ref ?= data_ref.;WRITE text_ref->*.;ASSIGN data_ref->* TO<fs>;WRITE <fs>;GET REFERENCE OF data_ref->* INTO text_ref. WRITE text_ref->*.;WRITE data_ref->*.;NULL;NULL;NULL;NULL;NULL;1;0;1;0;0;0;NULL;NULL;NULL;NULL;NULL
7;SAP;Which of the followings components are part of SAP NetWeaver AS ABAP version 7.1x and higher?;2;SAP GUI for Java;Internet Communication Manager (ICM);Message Server;Software Deployment Manager (SOM);NULL;NULL;NULL;NULL;NULL;NULL;NULL;0;1;1;0;NULL;NULL;NULL;NULL;NULL;NULL;NULL
8;SAP;You want to add a field ZZPRICE to the SAP standard transparent table EKKO.Which of the following actions result in an enhancement of the SAP standard?;2;Create an append structure and add ZZPRICE to it.;Insert ZZPRICE at the end of the table;Add ZZPRICE to the customizing include for the table;Insert ZZPRICE into an SAP structure for the table;NULL;NULL;NULL;NULL;NULL;NULL;NULL;1;0;1;0;NULL;NULL;NULL;NULL;NULL;NULL;NULL
9;SAP;What can be implemented using an implicit enhancement option?;3;Overwrite methods for SAP function modules;Additional exceptions in SAP function modules;Overwrite methods for global SAP classes;Additional parameters in SAP function modules;Additional attributes for global SAP classes;NULL;NULL;NULL;NULL;NULL;NULL;0;0;1;1;1;NULL;NULL;NULL;NULL;NULL;NULL
10;SAP;What are the advantages of defining texts symbols in executable programs?;2;They facilitate multilingual functionality.;They can store up to 256 characters.;The text of the text symbol can be changed at runtime;They are easier to maintain than literals.;NULL;NULL;NULL;NULL;NULL;NULL;NULL;1;0;0;1;NULL;NULL;NULL;NULL;NULL;NULL;NULL
11;SAP;At most, how many menu items (including functions, separators and sub- menus) can a menu have on the screen?;1;15;10;20;None of the above;NULL;NULL;NULL;NULL;NULL;NULL;NULL;1;0;0;0;NULL;NULL;NULL;NULL;NULL;NULL;NULL
12;SAP;Which of the following features do you have to consider when you use shared objects?;3;Data is saved as attributes of objects;Concurrent write accesses are supported;Memory bottlenecks result in runtime errors and have to be caught;Concurrent read accesses are supported;Data is saved as tables of objects;NULL;NULL;NULL;NULL;NULL;NULL;1;0;1;1;0;NULL;NULL;NULL;NULL;NULL;NULL
13;SAP;For which of the following purposes can you use the ABAP dictionary?;2;To create development classes;To activate logging for transparent tables;To create lock objects;To maintain program translations;NULL;NULL;NULL;NULL;NULL;NULL;NULL;0;1;1;0;NULL;NULL;NULL;NULL;NULL;NULL;NULL
14;SAP;You want to define a field symbol that will be assigned to a character string. Which generic types can you use?;3;xsequence;csequence;any table;clike;any;NULL;NULL;NULL;NULL;NULL;NULL;0;1;0;1;1;NULL;NULL;NULL;NULL;NULL;NULL
15;SAP;You need to create a piece of code that can be used by multiple programs. Which of the following techniques does SAP recommend?;2;Use a function module in a function group.;Use an include program.;Use a method in a local class.;Use a method in a global class;NULL;NULL;NULL;NULL;NULL;NULL;NULL;1;0;0;1;NULL;NULL;NULL;NULL;NULL;NULL;NULL
16;SAP;Which of the following ABAP statements throws an error at the syntax check?;1;DATA variable;DATA variable(5) TYPE n.;DATA variable(5) TYPE p.;DATA variable(5) TYPE t.;NULL;NULL;NULL;NULL;NULL;NULL;NULL;0;0;0;1;NULL;NULL;NULL;NULL;NULL;NULL;NULL
17;SAP;You define a generic variable that can hold the ABAP types C, D, N, STRING, and T. You want to restrict the use of other ABAP types. Which generic data type must you use in the definition?;1;CLIKE;DATA;CSEQUENCE;SIMPLE;NULL;NULL;NULL;NULL;NULL;NULL;NULL;1;0;0;0;NULL;NULL;NULL;NULL;NULL;NULL;NULL
18;SAP;Which ABAP statement using the local type gty_1 correctly defines a data object?;2;DATA gv_1 TYPE gty_1.;DATA gv_1 LIKE gty_1.;NULL;NULL;NULL;NULL;NULL;NULL;NULL;NULL;NULL;1;0;NULL;NULL;NULL;NULL;NULL;NULL;NULL;NULL;NULL
19;SAP;What can be defined using an implicit enhancement option?There are 3 correct answers to this question;3;Replacements for global SAP methods;Additional attributes in global SAP classes;Replacement for SAP function modules;Additional parameters in SAP function modules;Additional exceptions in SAP function modules;NULL;NULL;NULL;NULL;NULL;NULL;1;1;0;1;0;NULL;NULL;NULL;NULL;NULL;NULL
20;SAP;What do global types and local types have in common?;1;Documentation;Field labels;Search help;Technical information;NULL;NULL;NULL;NULL;NULL;NULL;NULL;0;0;0;1;NULL;NULL;NULL;NULL;NULL;NULL;NULL
21;SAP;How can you improve the performance when accessing a large data volume database table?Please choose the correct answer.;1;Apply the appropriate data class and size category.;Switch the database table to fully buffered.;Define appropriate indexes for the database table.;Change the table type in the dictionary;NULL;NULL;NULL;NULL;NULL;NULL;NULL;0;0;1;0;NULL;NULL;NULL;NULL;NULL;NULL;NULL
22;SAP;You defined data reference z1 generically.Which statement would you use to access the content of the referenced variable?;1;Assign (z1) to <fs>;Assign z1 to <fs>;Assign z1->* to <fs>;Get reference of z1 into wa;NULL;NULL;NULL;NULL;NULL;NULL;NULL;0;0;1;0;NULL;NULL;NULL;NULL;NULL;NULL;NULL
23;SAP;Identify the types of layout managers. ;4;FlowLayout;RowLayout;ColumnLayout;MatrixLayout;GridLayout;TreeLayout;NULL;NULL;NULL;NULL;NULL;1;1;0;1;1;0;NULL;NULL;NULL;NULL;NULL
24;SAP;A structure has enhancement category 3, can be enhanced (character-type).Which set of elementary types is allowed for the new fields?;1;C,D,N,T;C,D,N,X;D,I,string, T;F,I,P,X;NULL;NULL;NULL;NULL;NULL;NULL;NULL;1;0;0;0;NULL;NULL;NULL;NULL;NULL;NULL;NULL
25;SAP;SAP enhancements for customer exits are managed by which transaction?;1;Transaction SMOD;Transaction CMOD;Neither transaction listed here;ApplicationCMOD;NULL;NULL;NULL;NULL;NULL;NULL;NULL;1;0;0;0;NULL;NULL;NULL;NULL;NULL;NULL;NULL
26;SAP;You want to include an element of type Table in your web dynpro.What actions add the corresponding columns to the table automatically?;1;Include the method BIND_TABLE of IF_WD_CONTEXT_NODE.;Bind the table attribute DATA_SOURCE to the context node;Right click the table and select the CREATE_BINDING option;Generate a BIND_TABLE method using the web dynpro method wizard.;NULL;NULL;NULL;NULL;NULL;NULL;NULL;1;0;0;0;NULL;NULL;NULL;NULL;NULL;NULL;NULL
27;SAP;Where can you define global data types that are visible system-wide?;3;In a method of a global class;In the ABAP Dictionary;In a function module;In a global class;In a global interface;NULL;NULL;NULL;NULL;NULL;NULL;0;1;0;1;1;NULL;NULL;NULL;NULL;NULL;NULL
28;SAP;Which enhancements can provide a screen exit?;3;Explicit enhancement sections;New BAdIs;Classic BAdIs;Customer exits;Explicit enhancement points;NULL;NULL;NULL;NULL;NULL;NULL;0;1;1;1;0;NULL;NULL;NULL;NULL;NULL;NULL
29;SAP;Which of the following enhancement options does not require any preparation from SAP?;1;New BAdIs;Explicit enhancement point;Explicit enhancement sections;Implicit enhancement point;NULL;NULL;NULL;NULL;NULL;NULL;NULL;0;0;0;1;NULL;NULL;NULL;NULL;NULL;NULL;NULL
30;SAP;What happens when an authorization check fails?;1;The program is terminated.;The system field SY-SUBRC is set to a value other than zero.;A type E message is displayed.;A CX_AUTH_FAILED type exception is raised.;NULL;NULL;NULL;NULL;NULL;NULL;NULL;0;1;0;0;NULL;NULL;NULL;NULL;NULL;NULL;NULL
31;SAP;Which of the following regarding search helps is a true statement?Please select all the correct answers that apply.;NULL;The interface for the search help is defined by the IMP (import) and EXP (export) flag of the search help parameter.;The LPos parameter defines the position of the search help parameter in the search hit list.;The SPos parameter defines the position of the input field on the dialog screen.;The text table for the selection method is automatically populated if the text table is attached to the database table being used as the selection method.;NULL;NULL;NULL;NULL;NULL;NULL;NULL;1;1;1;1;NULL;NULL;NULL;NULL;NULL;NULL;NULL
32;SAP;Which of the following rules must you follow when creating subscreens?;2;Subscreens CANNOT have a field of type OK.;Subscreens can have a dialog module containing SET PF-STATUS.;Subscreens can call other subscreens.;Subscreens CANNOT have an AT EXIT-COMMAND module.;NULL;NULL;NULL;NULL;NULL;NULL;NULL;1;0;0;1;NULL;NULL;NULL;NULL;NULL;NULL;NULL
33;SAP;You want to develop a program that processes character type data. When you implement the program, you can either use the classical string statements or the newer strings expressions and functionsWhat are the main benefits of using string expressions and string functions?;2;You can write compact syntax instead of a long sequence of statements;You can reduce the number of intermediate variables;You can improve the performance significantly;You can write code that is very easy to read and understand;NULL;NULL;NULL;NULL;NULL;NULL;NULL;1;1;0;0;NULL;NULL;NULL;NULL;NULL;NULL;NULL
34;SAP;Which of the elementary data types is deep?;1;N;XSTRING;DECFLOAT34;X;NULL;NULL;NULL;NULL;NULL;NULL;NULL;0;1;0;0;NULL;NULL;NULL;NULL;NULL;NULL;NULL
35;SAP;Which property of the InputField UI element must be bound to a context attribute?;1;state;enable;value;visible;NULL;NULL;NULL;NULL;NULL;NULL;NULL;0;0;1;0;NULL;NULL;NULL;NULL;NULL;NULL;NULL
36;SAP;Which of the following interface technologies are available in SAP systems?;3;OLE;Ethernet;HTTP;RFC;ODBC;NULL;NULL;NULL;NULL;NULL;NULL;1;0;1;1;0;NULL;NULL;NULL;NULL;NULL;NULL
37;SAP;What is the difference between a value table and a check table?;1;"No difference; they are the same thing.";A value table is a check table after a foreign key is defined.;A value table is defined in the domain, whereas a check table is defined in the data element.;A check table is defined in the domain, whereas a value table is defined in the data element.;A value table does not exist.;NULL;NULL;NULL;NULL;NULL;NULL;0;1;0;0;0;NULL;NULL;NULL;NULL;NULL;NULL
38;SAP;When is a foreign key check performed on an input/output field?;1;If the field refers to the dictionary field for which a check table is defined;If the field refers to the dictionary field for which a append search is defined;If the field refers to the dictionary field for which a search is defined;If the field refers to the dictionary field for which a value help is defined;NULL;NULL;NULL;NULL;NULL;NULL;NULL;1;0;0;0;NULL;NULL;NULL;NULL;NULL;NULL;NULL
39;SAP;Which types of programs or parts of programs can be tested directly from the ABAP Workbench or ABAP Editor?;4;REPORT;PROGRAM;FUNCTION-POOL;FUNCTION MODULE;CLASS-POOL;METHOD;INTERFACE-POOL;TYPE-POOL;INCLUDE;NULL;NULL;1;0;0;1;1;1;0;0;0;NULL;NULL
40;SAP;Which database objects can you create in the ABAP Dictionary?;2;Projection views;Logical databases;Indexes;Foreign key relationships;NULL;NULL;NULL;NULL;NULL;NULL;NULL;1;0;1;0;NULL;NULL;NULL;NULL;NULL;NULL;NULL
41;SAP;The software component for a customer package can be...;1;HOME;Any SAP software component (i.e., SAP_APPL, SAP_BASIS, SAP_HR, etc.);Application Layer;Database layer;NULL;NULL;NULL;NULL;NULL;NULL;NULL;1;0;0;0;NULL;NULL;NULL;NULL;NULL;NULL;NULL
42;SAP;Which of the following can you define in the technical settings of a transparent table?;3;Buffering type;Size category;Data class;Table name;Delivery class;NULL;NULL;NULL;NULL;NULL;NULL;1;1;1;0;0;NULL;NULL;NULL;NULL;NULL;NULL
43;SAP;In an ABAP program, you to assign an initial value to an elementary data object when you define it. Which addition must you use?;1;OBLIGATORY;DEFAULT;READ-ONLY;VALUE;NULL;NULL;NULL;NULL;NULL;NULL;NULL;0;0;0;1;NULL;NULL;NULL;NULL;NULL;NULL;NULL
44;SAP;You Created the following ABAP Code:DATA x TYPE REF TO DATADATA y TYPE REF TO OBJECTASSIGN x TO <fs>ASSIGN y TO <fs>You want to add a declaration of <fs> to the Code.Which of the Following Declarations are Valid?;2;FIELD-SYMBOLS <fs>;FIELD-SYMBOLS <fs> TYPE REF TO ANY;FIELD-SYMBOLS TYPE REF TO DATA;FIELD-SYMBOLS <fs> TYPE ANY;NULL;NULL;NULL;NULL;NULL;NULL;NULL;1;0;0;1;NULL;NULL;NULL;NULL;NULL;NULL;NULL
45;SAP;What can you change in the ABAP Debugger?;1;Content of an internal table;Value of a reference variable;Value of a constant;Definition of a structure;NULL;NULL;NULL;NULL;NULL;NULL;NULL;1;0;0;0;NULL;NULL;NULL;NULL;NULL;NULL;NULL
46;SAP;Dynpros can be placed in which program types? ;3;Executables;Module pools;Function groups;Class pools;NULL;NULL;NULL;NULL;NULL;NULL;NULL;1;1;1;0;NULL;NULL;NULL;NULL;NULL;NULL;NULL
47;SAP;What is the correct order for using a lock object?;1;Read the data, set the lock, change the data, release the lock;Set the lock, read the data, change the data, release the lock;Set the lock, read the data, release the lock, change the data;release the lock, Read the data, set the lock, change the data;NULL;NULL;NULL;NULL;NULL;NULL;NULL;0;1;0;0;NULL;NULL;NULL;NULL;NULL;NULL;NULL
48;SAP;Which components of the class can be accessed in the implementation of a static method in that class?;2;Constants;All events;Instance attributes;Types;NULL;NULL;NULL;NULL;NULL;NULL;NULL;1;0;0;1;NULL;NULL;NULL;NULL;NULL;NULL;NULL
49;SAP;Which does the field catalog allow you to do?;3;Add a field to the display;Specify the sort order of the display table;Produce a striped pattern for the display lines;Change the title of a column;Change the display order of a column;NULL;NULL;NULL;NULL;NULL;NULL;1;0;0;1;1;NULL;NULL;NULL;NULL;NULL;NULL
50;SAP;Which of the following statements are true? ;2;A conversion routine can be assigned to a domain.;A conversion routine can be assigned to a data element.;You define the value range in the data element.;You can enter documentation for the data element in the ABAP Dictionary.;NULL;NULL;NULL;NULL;NULL;NULL;NULL;1;0;0;1;NULL;NULL;NULL;NULL;NULL;NULL;NULL
51;SAP;You want to select all the records from a database table where field CITY contains substring BU in any position. Which WHERE clause can you use in an Open SQL select statement?;1;WHERE city LIKE *BU*;WHERE city LIKE _BU;WHERE city LIKE %BU*;WHERE city LIKE %BU%;NULL;NULL;NULL;NULL;NULL;NULL;NULL;0;0;0;1;NULL;NULL;NULL;NULL;NULL;NULL;NULL
52;SAP;What is the root class in the RTTS inheritance tree?;1;CL_ABAP_ELEMDESCR;CL_ABAP_TYPEDESCR;CL_ABAP_DATADESCR;CL_ABAP_COMPLEXDESCR;NULL;NULL;NULL;NULL;NULL;NULL;NULL;0;1;0;0;NULL;NULL;NULL;NULL;NULL;NULL;NULL
53;SAP;What is data binding?;1;Connecting an outbound plug on one view to the inbound plug of another view;Connecting one Web Dynpro component to another Web Dynpro component;Connecting a context node in one controller to a context node in another controller;Connecting the values of user interface elements to the context attributes of the corresponding controller;NULL;NULL;NULL;NULL;NULL;NULL;NULL;0;0;0;1;NULL;NULL;NULL;NULL;NULL;NULL;NULL
54;SAP;What must you do to define a database view using the ABAP Dictionary?;3;Choose the database tables from where the view acquires data.;Define the join conditions between the tables.;Choose the fields from the tables that should be part of the view.;Define selection criteria for the view.;Define buffering settings for the underlying database tables.;NULL;NULL;NULL;NULL;NULL;NULL;1;1;1;0;0;NULL;NULL;NULL;NULL;NULL;NULL
55;SAP;Which of the following controller types can exist only once in a Web Dynpro component?;2;Window controller;Component controller;Configuration controller;View controller;NULL;NULL;NULL;NULL;NULL;NULL;NULL;0;1;1;0;NULL;NULL;NULL;NULL;NULL;NULL;NULL
56;SAP;You have implemented a class CL_CUSTOMER in which you defined a private attribute. From where can you access this attribute directly?;2;From all methods of all subclasses of CL_CUSTOMER;From all methods of the class CL_CUSTOMER;From all methods of a class to which CL_CUSTOMER grants friendship;From any program using the class CL_CUSTOMER;NULL;NULL;NULL;NULL;NULL;NULL;NULL;0;1;1;0;NULL;NULL;NULL;NULL;NULL;NULL;NULL
57;SAP;Which statements are allowed for processing internal tables?;3;SELECT;INSERT;DELETE;MODIFY;UPDATE;NULL;NULL;NULL;NULL;NULL;NULL;0;1;1;1;0;NULL;NULL;NULL;NULL;NULL;NULL
58;SAP;What is the ALV Object Model?;1;A group of classes that describe the ALV Grid as a whole and inherit from a single class;A group of hierarchal classes that describe the ALV Grid as a whole but do not inherit from a single class;A group of classes that describe the BDCGrid as a whole and inherit from a single class;A group of classes that apply Grid as a whole and inherit from a multiple class;NULL;NULL;NULL;NULL;NULL;NULL;NULL;0;1;0;0;NULL;NULL;NULL;NULL;NULL;NULL;NULL
59;SAP;Which of the following can you do with the SAP code inspector?;1;Monitor runtime behavior;Monitor background tasks;Perform static code checks;Analyze runtime data.;NULL;NULL;NULL;NULL;NULL;NULL;NULL;0;0;1;0;NULL;NULL;NULL;NULL;NULL;NULL;NULL
60;SAP;Which view types can you use to join two tables with an outer join?;2;Database view;Projection view;Maintenance view;Help view;NULL;NULL;NULL;NULL;NULL;NULL;NULL;0;0;1;1;NULL;NULL;NULL;NULL;NULL;NULL;NULL
61;SAP;Where are fixed values for fields stored?;1;Table;Structure;Field;Data element;Domain;NULL;NULL;NULL;NULL;NULL;NULL;0;0;0;0;1;NULL;NULL;NULL;NULL;NULL;NULL
62;SAP;Identify the ways to map context structures. ;2;Direct context mapping;External context mapping;Dynamic context mapping;Static context mapping;NULL;NULL;NULL;NULL;NULL;NULL;NULL;1;1;0;0;NULL;NULL;NULL;NULL;NULL;NULL;NULL
63;SAP;Which of the following are valid control level changes within a loop over an internal table?;2;END of <f>;LAST;SUM;COLLECT;NULL;NULL;NULL;NULL;NULL;NULL;NULL;1;1;0;0;NULL;NULL;NULL;NULL;NULL;NULL;NULL
64;SAP;How many kinds of internal tables are supported in the ABAP language?;1;2;3;1;5;NULL;NULL;NULL;NULL;NULL;NULL;NULL;0;1;0;0;NULL;NULL;NULL;NULL;NULL;NULL;NULL
65;SAP;dbtab is a transparent table. What is declared by the following statement? DATA myvar TYPE dbtab.;1;A structure variable;An elementary field;An internal table;A reference to an internal table;NULL;NULL;NULL;NULL;NULL;NULL;NULL;1;0;0;0;NULL;NULL;NULL;NULL;NULL;NULL;NULL
66;SAP;Which boundary conditions lead to improved access time to an internal table?;3;Left justified part of key for sorted tables;Fully qualified key for sorted tables;Index access for hashed tables;Left justified part of key for hashed tables;Index access for standard tables;NULL;NULL;NULL;NULL;NULL;NULL;1;1;0;0;1;NULL;NULL;NULL;NULL;NULL;NULL
67;SAP;What are the reasons to use modularization?;3;Improved transparency;Easier maintenance;Improved performance;Promotes reusability;Portability across DBMS;NULL;NULL;NULL;NULL;NULL;NULL;1;1;0;1;0;NULL;NULL;NULL;NULL;NULL;NULL
68;SAP;Which of the following statements are correct? ;4;Class methods assigned to the public visibility section can be accessed outside the class using the static component selector and the class name.;Static methods can be defined in both the public and private visibility section of the class.;Only public methods can be addressed outside the class.;You can call private methods within the public methods without reference to the object or class.;None of the above;NULL;NULL;NULL;NULL;NULL;NULL;1;1;1;1;0;NULL;NULL;NULL;NULL;NULL;NULL
69;SAP;Which parameter types can be used in the signature of a functional method?;2;EXPORTING;IMPORTING;RETURNING;CHANGING;NULL;NULL;NULL;NULL;NULL;NULL;NULL;0;1;1;0;NULL;NULL;NULL;NULL;NULL;NULL;NULL
70;SAP;You have created a Web Dynpro view that shows data for airline connections between cities. You want to display flight data for a specific date in a different view after the user select a date and presses a button. Which of the following actions you must perform?;2;Set the interface property for key fields;Edit the handler method in the view controller;Add a client-side event in the view;Create and link plugs between the views;NULL;NULL;NULL;NULL;NULL;NULL;NULL;0;1;0;1;NULL;NULL;NULL;NULL;NULL;NULL;NULL
71;SAP;What does the enhancement category for a database table or structure do?;3;Makes a table Unicode-compliant;Specifies the types of changes that can be made to the structure;Can produce warnings at incompatible points for the structure;Can identify where program behavior may change;NULL;NULL;NULL;NULL;NULL;NULL;NULL;0;1;1;1;NULL;NULL;NULL;NULL;NULL;NULL;NULL
72;SAP;How is data shared between Web Dynpro controllers?;2;By using data binding from a view controller to another view controller;By using context mapping from a view controller to the component controller;By using context mapping from a view controller to a custom controller;By using context mapping from a view controller to another view controller;NULL;NULL;NULL;NULL;NULL;NULL;NULL;0;1;1;0;NULL;NULL;NULL;NULL;NULL;NULL;NULL
73;SAP;Which statement ends a screen sequence and starts from initial screen?;1;CALL SCREEN;LEAVE TO SCREEN;SET SCREEN 0;LEAVE SCREEN;NULL;NULL;NULL;NULL;NULL;NULL;NULL;0;0;1;0;NULL;NULL;NULL;NULL;NULL;NULL;NULL
74;SAP;Table A and table B are partially buffered.Which of the following SELECT statements always access the database?;2;SELECT SINGLE CLIENT SPECIFIED a b FROM table A;INTO CORRESPONDING FIELDS OFls_AB.;SELECT a b c d FROM table A JOIN table B ON table A~aEQtable B~;eINTO CORRESPONDING FIELDS OF TABLElt_A_B.;SELECT a b FROM table A INTO CORRESPONDING FIELDS OF TABLE lt_AB;SELECT SINGLE FOR UPDATE a b FROM table A INTO CORRESPONDING FIELDS OF ls_A WHERE c EQ 1234.;NULL;NULL;NULL;NULL;NULL;0;0;1;0;0;1;NULL;NULL;NULL;NULL;NULL
75;SAP;In which event block can you overwrite the default value of a PARAMETERS field on the selection screen?;1;START-OF-SELECTION;AT SELECTION-SCREEN;PROCESS BEFORE OUTPUT;INITIALIZATION;NULL;NULL;NULL;NULL;NULL;NULL;NULL;0;0;0;1;NULL;NULL;NULL;NULL;NULL;NULL;NULL
76;SAP;How can you search for classic Business Add-Ins (BAdIs)?;2;Search in the application program for the GET BADI statement.;Search in the application program for the method GET_ INSTANCE of class CL_EXITHANDLER.;Search the relevant component in the Implementation Guide (IMG).;Search in the application program for the CALL BADI statement.;NULL;NULL;NULL;NULL;NULL;NULL;NULL;0;1;1;0;NULL;NULL;NULL;NULL;NULL;NULL;NULL
77;SAP;An executableABAPprogram contains a standard selection screen and uses the event blocks AT SELECTION SCREEN, AT SELECTION-SCREEN OUTPUT, INITIALIZATION,START-OFSELECTION.In which sequence willABAPruntime call these event blocks?;1;1. INITIALIZATION;2. AT SELECTION-SCREEN OUTPUT;3. AT SELECTION-SCREEN;4. START-OF-SELECTION;NULL;NULL;NULL;NULL;NULL;NULL;NULL;1;0;0;0;NULL;NULL;NULL;NULL;NULL;NULL;NULL
78;SAP;Which of the following ABAP data types are compatible with the generic character-type CLIKE?;3;STRING;N;C;XSTRING;DECFLOAT;NULL;NULL;NULL;NULL;NULL;NULL;1;1;1;0;0;NULL;NULL;NULL;NULL;NULL;NULL
79;SAP;Which selection screen elements allow user input in ABAP Reports?;2;SELECTION-SCREEN BLOCK;PARAMETERS;SELECTION-SCREEN COMMENT;SELECT-OPTIONS;NULL;NULL;NULL;NULL;NULL;NULL;NULL;0;1;0;1;NULL;NULL;NULL;NULL;NULL;NULL;NULL
80;SAP;Which type of view cannot be used in a search help?;1;Database view;Maintenance view;Help view;Candidates key view;NULL;NULL;NULL;NULL;NULL;NULL;NULL;0;1;0;0;NULL;NULL;NULL;NULL;NULL;NULL;NULL
