ID;type;description;nbAns;Answer1;Answer2;Answer3;Answer4;Answer5;Answer6;Answer7;Answer8;Answer9;Answer10;Answer11;Valid1;Valid2;Valid3;Valid4;Valid5;Valid6;Valid7;Valid8;Valid9;Valid10;Valid11
305;SAP;Which of the following statements dynamically changes the data type of field z1?;1;Assign z1 to <fs>;Move z1 to <fs>;Assign z1 to <fs> casting;Unassign <fs>;NULL;NULL;NULL;NULL;NULL;NULL;NULL;0;0;1;0;NULL;NULL;NULL;NULL;NULL;NULL;NULL
306;SAP;You write a report that displays mass data in a table. You decide to use the ALV Grid control (classCL_GUI_ALV_GRID) instead of a classical list display with WRITE statements.Which of the following functions can you offer to the user without doing any specific programming;2;Sort and filter the data by any column;Change column width and sequence;Convert currency amount columns;Display details by double-clicking on a row;NULL;NULL;NULL;NULL;NULL;NULL;NULL;1;1;0;0;NULL;NULL;NULL;NULL;NULL;NULL;NULL
307;SAP;Which of the following actions can you performing both the ABAP Editor and in the ABAP Debugger?;1;Create a breakpoint for a specificline.;Create a watchpoint for a specific variable.;Create a breakpoint for a specific statement.;Create a breakpoint for a specific message.;NULL;NULL;NULL;NULL;NULL;NULL;NULL;1;0;0;0;NULL;NULL;NULL;NULL;NULL;NULL;NULL
308;SAP;A view can only be displayed in which circumstances?;1;It can always be displayed.;It contains an inbound and outbound plug.;It cannot always be displayed.;It has been embedded in a window.;NULL;NULL;NULL;NULL;NULL;NULL;NULL;0;0;0;1;NULL;NULL;NULL;NULL;NULL;NULL;NULL
309;SAP;The statements CALL BADI and GET BADI are used for which type of BAdIs?;1;ClassicalDDic;New BAdI;None of the above;Classical BAdI;NULL;NULL;NULL;NULL;NULL;NULL;NULL;0;1;0;0;NULL;NULL;NULL;NULL;NULL;NULL;NULL
310;SAP;Which steps are needed when implementing the singleton concept for class instantiation with minimum coding?;3;Define the instantiation of the class as private.;Create an instance of the class in a static constructor.;Define the class as abstract.;Save the instance of the class in a static attribute.;Create an event that returns the instance of the class.;NULL;NULL;NULL;NULL;NULL;NULL;1;1;0;1;0;NULL;NULL;NULL;NULL;NULL;NULL
311;SAP;How do you embed a subscreen in a main screen?;1;Use SET SUBSCREEN in a PBO module of the main screen.;Use SET SUBSCREEN in the flow logic of the main screen.;Use CALL SUBSCREEN in the flow logic of the main screen.;Use CALL SUBSCREEN in a PBO module of the main screen;NULL;NULL;NULL;NULL;NULL;NULL;NULL;0;0;1;0;NULL;NULL;NULL;NULL;NULL;NULL;NULL
312;SAP;"""You created a transparent table and during activation got a warning message """"Enhancement category for table missing"""".""What do you have to do to eliminate the warning message? ";1;Select any option other than Not Classified from the enhancement category;Change the Data Class and Size category in the technical settings.;Provide the correct reference field for the Currency or Quantity field.;Select the option Not Classified from the enhancement category.;NULL;NULL;NULL;NULL;NULL;NULL;NULL;1;0;0;0;NULL;NULL;NULL;NULL;NULL;NULL;NULL
313;SAP;What can you use to achieve polymorphism?;1;Events;Subroutines;Inheritance;Reports;NULL;NULL;NULL;NULL;NULL;NULL;NULL;0;0;1;0;NULL;NULL;NULL;NULL;NULL;NULL;NULL
314;SAP;Which of the following components belong to the SAP application layer?;2;ABAP dispatcher;Database server;SAP GUI;Database interface;NULL;NULL;NULL;NULL;NULL;NULL;NULL;1;0;0;1;NULL;NULL;NULL;NULL;NULL;NULL;NULL
315;SAP;When does SAP recommend that you use a full buffering type for a database table?;1;When the table is small and frequently written;When the table is small and seldom written;When the table is large and frequently written;When the table is large and seldom written;NULL;NULL;NULL;NULL;NULL;NULL;NULL;0;1;0;0;NULL;NULL;NULL;NULL;NULL;NULL;NULL
316;SAP;Which of the following items are used in a Web Dynpro Application to transport database data to the user interface?;2;Inbound plug;Interface controller;Context node;Supply function;NULL;NULL;NULL;NULL;NULL;NULL;NULL;0;1;1;0;NULL;NULL;NULL;NULL;NULL;NULL;NULL
317;SAP;How can you add a session breakpoint to your program?;2;Set a breakpoint in the ABAP editor;Execute command /h;Set a breakpoint in the ABAP editor and select Save.;Set a breakpoint in the ABAP debugger and press F8;NULL;NULL;NULL;NULL;NULL;NULL;NULL;1;1;0;0;NULL;NULL;NULL;NULL;NULL;NULL;NULL
318;SAP;When does the lifetime of a component controller begin and end?;1;It begins with the Web Dynpro component and ends with the Web Dynpro application that called it.;It begins the first time the Web Dynpro application is called at runtime and ends when the Web Dynpro application that called and instantiated the component ends.;It lasts from creating data within the controller to cover the whole period during which the component is in use.;It ends the first time the WebDynproapplication is called at runtime and ends when the WebDynproapplication that called andinstantiatedthe component ends.;NULL;NULL;NULL;NULL;NULL;NULL;NULL;0;0;1;0;NULL;NULL;NULL;NULL;NULL;NULL;NULL
319;SAP;What scheduling technique is used by the ABAP debugger dispatcher for processing user requests?;1;Multiple Queue;First in , First out;Round Robin;Shortest First;NULL;NULL;NULL;NULL;NULL;NULL;NULL;0;1;0;0;NULL;NULL;NULL;NULL;NULL;NULL;NULL
320;SAP;What is the difference between SAP Basis and SAP NetWeaver?;1;"There is no difference; the name change was driven by marketing alone.";All versions of SAP NetWeaver require the use of Unicode.;All versions of SAP NetWeaver include the ability to handle HTTP requests.;All versions of SAPNetWeaverrequire the use ofUTF-8.;NULL;NULL;NULL;NULL;NULL;NULL;NULL;0;0;1;0;NULL;NULL;NULL;NULL;NULL;NULL;NULL
321;SAP;Which of the following enhancements calls a customer function module.;2;Customer exit;User exit;Business Transaction event;Business Add-in (BADIs);NULL;NULL;NULL;NULL;NULL;NULL;NULL;1;0;0;1;NULL;NULL;NULL;NULL;NULL;NULL;NULL
322;SAP;Which of the following rules must you follow when you create a static constructor?;2;You CANNOT define parameters.;You must name the method CONSTRUCTOR.;You must define the method as pubic.;You can define class-based or classic exceptions.;NULL;NULL;NULL;NULL;NULL;NULL;NULL;1;0;1;0;NULL;NULL;NULL;NULL;NULL;NULL;NULL
323;SAP;Global data types defined in SAP systems are;1;Data defined in the program that is visible to all the routines/statements within the ABAP program.;ABAP Dictionary types.;Date types defined in the program using ABAP Dictionary types.;Date types does not defined Dictionary types.;NULL;NULL;NULL;NULL;NULL;NULL;NULL;0;1;0;0;NULL;NULL;NULL;NULL;NULL;NULL;NULL
324;SAP;Which of the following settings can you define for both structures and transparent tables in the ABAP Dictionary?;2;Foreign key relationships;Size category;Storage type;Enhancement category;NULL;NULL;NULL;NULL;NULL;NULL;NULL;1;0;0;1;NULL;NULL;NULL;NULL;NULL;NULL;NULL
325;SAP;How is an ABAP program with several dialog steps executed?;1;The program is always executed in just one dialog work process without roll out;The ABAP dispatcher takes over the entire execution without assigning any work process.;The program is always executed in just one dialog work process with roll out.;Usually, dialog steps are assigned to different dialog work processes.;NULL;NULL;NULL;NULL;NULL;NULL;NULL;0;0;0;1;NULL;NULL;NULL;NULL;NULL;NULL;NULL
326;SAP;Your colleague has asked you to analyze an ABAP program that does not behave correctly when a button is pressed on the initial screen. You want to start the Debugger when the button is pressed so that you can perform your analysis.What system command do you type in the command field?;1;/n;Jdbg;/h;/hx;NULL;NULL;NULL;NULL;NULL;NULL;NULL;0;0;1;0;NULL;NULL;NULL;NULL;NULL;NULL;NULL
327;SAP;You display the content of an internal table using an ALV grid control. The content of the internal table changes during the program. Which CL_GUI_ALV_GRID class method can you use to display the changed content?;1;REFRESH_TABLE_DISPLAY in module PAI;SET_TABLE _FOR_FIRST_DISPLAY in module PBO;SET_TABLE_FOR_FIRST_DISPLAY in module PAI;REFRESH_TABLE_DISPLAY in module PBO;NULL;NULL;NULL;NULL;NULL;NULL;NULL;0;0;0;1;NULL;NULL;NULL;NULL;NULL;NULL;NULL
328;SAP;In a subclass, you want to redefine a method of the super class. Which of the following conditions must be fulfilled?;2;The subclass method has a lower visibility than the super class method;The super class method is abstract;The superclass method is an instance method;The subclass method has same visibility as the super class method;NULL;NULL;NULL;NULL;NULL;NULL;NULL;0;0;1;1;NULL;NULL;NULL;NULL;NULL;NULL;NULL
329;SAP;When is an ENDSELECT not required for a SELECT?;3;When the FROM is a view;When you specify a join of tables;When you do a SELECT SINGLE;When you specify into a table;When you specify appending a table;NULL;NULL;NULL;NULL;NULL;NULL;0;0;1;1;1;NULL;NULL;NULL;NULL;NULL;NULL
330;SAP;What must you do to create a singleton class?;2;Define the class as abstract.;Set the class instantiation to private.;Create the objection a static method of the class itself.;Store the reference to the singleton objection an instance attribute of the object itself.;NULL;NULL;NULL;NULL;NULL;NULL;NULL;0;1;1;0;NULL;NULL;NULL;NULL;NULL;NULL;NULL
331;SAP;Which of the following conditions must be fulfilled when using a GROUP BY clause in a SELECT statement?;2;The SELECT statement must also have a WHERE clause.;All fields in the SELECT clause that are not part of an aggregate function must be listed after GROUP BY.;The table in the FROM clause must be a transparent table.;The fields after GROUP BY must have a character type.;NULL;NULL;NULL;NULL;NULL;NULL;NULL;0;1;1;0;NULL;NULL;NULL;NULL;NULL;NULL;NULL
332;SAP;In which circumstances is a table considered to be a text table?;3;The entire key of this data table is included as the key to this table.;This table has an additional language key field.;This table only has one character-based data field.;This table has a foreign key to the data table as a text table.;The ABAP runtime system determines that the relationship exists.;NULL;NULL;NULL;NULL;NULL;NULL;1;1;0;1;0;NULL;NULL;NULL;NULL;NULL;NULL
333;SAP;What are some of the new features of Open SQL in SAP NetWeaver 7.5?;2;CASE expressions;Full Join;Intersection;String expressions;NULL;NULL;NULL;NULL;NULL;NULL;NULL;1;0;0;1;NULL;NULL;NULL;NULL;NULL;NULL;NULL
334;SAP;What are some of the advantages of using OPEN SQL?;2;All standard SQL commands can be used;Syntax is checked at design time;It can be used with any supportedDBMS;The application server buffer is NOT used;NULL;NULL;NULL;NULL;NULL;NULL;NULL;1;1;0;0;NULL;NULL;NULL;NULL;NULL;NULL;NULL
335;SAP;Which of the following capabilities is provided by the Application Layer platform of SAP Netweaver?;1;Business process management;Multi-channel access;Database and operating system abstraction;Master data management;NULL;NULL;NULL;NULL;NULL;NULL;NULL;0;0;1;0;NULL;NULL;NULL;NULL;NULL;NULL;NULL
336;SAP;Which of the following variables is the self-reference variable in ABAP OO?;1;THIS;SENDER;ME;SUPER;NULL;NULL;NULL;NULL;NULL;NULL;NULL;0;0;1;0;NULL;NULL;NULL;NULL;NULL;NULL;NULL
337;SAP;You are establishing the business logic layer for a Web Dynpro Component. Which service types are available in the Service Call wizard?;3;Transaction code;Web service proxy;Class method;Function module;Function group;NULL;NULL;NULL;NULL;NULL;NULL;0;1;1;1;0;NULL;NULL;NULL;NULL;NULL;NULL
338;SAP;What is the SAP recommended naming convention for append structures of standard SAPtables?Please choose the correct answer.;NULL;The name of the append structure must start with ZA.;The components of an append structure should start with ZZ or YY.;The components of an append structure should start with Z or Y.;The name of the append structure must start with ZZ or YY.;NULL;NULL;NULL;NULL;NULL;NULL;NULL;0;1;0;0;NULL;NULL;NULL;NULL;NULL;NULL;NULL
339;SAP;What is the difference between the INITIALIZATION and AT SELECTION-SCREEN OUTPUT events?Please choose the correct answer;NULL;#NOM?;#NOM?;#NOM?;#NOM?;#NOM?;#NOM?;#NOM?;#NOM?;NULL;NULL;NULL;0;0;0;0;1;0;0;0;NULL;NULL;NULL
340;SAP;What is a plug?;4;Can be defined as inbound, outbound, or both;Forms the basis of navigation within a Web Dynpro;Can be defined as default inbound;Can be defined as a startup;Can be defined as an exit;Can be assigned to multiple views;Can be defined as outbound controlling multiple inbound plugs;Can be defined as inbound and be controlled by multiple outbound plugs;NULL;NULL;NULL;0;1;0;1;1;0;0;1;NULL;NULL;NULL
341;SAP;You define a formal parameter to a subroutine that accepts only internal table of type standard and type sorted as actual parameters. Which of the following generic ABAP data types must you use?;1;Hashed table;Standard table;Index table;Sorted table;NULL;NULL;NULL;NULL;NULL;NULL;NULL;0;0;1;0;NULL;NULL;NULL;NULL;NULL;NULL;NULL
342;SAP;What properties will be set when you define a table type in the ABAP Dictionary?;3;Change document;Access mode;Primary key;Line type;GET/SET Parameter;NULL;NULL;NULL;NULL;NULL;NULL;0;1;1;1;0;NULL;NULL;NULL;NULL;NULL;NULL
343;SAP;What is the difference between a Unicode and non-Unicode program? Please select all the correct answers that apply.;NULL;Byte-type data objects cannot be assigned to character-type data objects.;Byte-type data objects cannot be compared to character-type data objects.;Offset positioning in a Unicode structure is restricted to character data objects.;Offset positioning in a Unicode structure is restricted to flat data objects.;NULL;NULL;NULL;NULL;NULL;NULL;NULL;1;1;1;1;NULL;NULL;NULL;NULL;NULL;NULL;NULL
344;SAP;Which action on the underlying dictionary objects triggers a database table conversion?;1;Inserting an APPEND structure;Changing the order of non-key fields;Inserting a field of type reference;Reducing the size of the field.;NULL;NULL;NULL;NULL;NULL;NULL;NULL;0;0;0;1;NULL;NULL;NULL;NULL;NULL;NULL;NULL
345;SAP;You have written a method implementation containing the following access to an internal table defined as a changing parameter of the method. READ TABLE ct_itab INTO cs_struc INDEX 1.What are the possible type definitions for parameter ct_itab?;3;Standard Table;Any Table;Hashed Table;Index Table;Sorted Table;NULL;NULL;NULL;NULL;NULL;NULL;1;1;0;0;1;NULL;NULL;NULL;NULL;NULL;NULL
346;SAP;Where can you define data types that can be accessed directly by all ABAp repository objects in an SAP system?;2;In a function module;In a global class;In a method;In the ABAP dictionary;NULL;NULL;NULL;NULL;NULL;NULL;NULL;0;1;0;1;NULL;NULL;NULL;NULL;NULL;NULL;NULL
347;SAP;You have created table ZTAB and you want to create a foreign-key relationship to table SAPTAB. Under which condition is this possible?;1;The check field in ZTAB must have a data element that does NOT refer to a domain.;The check field in ZTAB must have the same ABAP Dictionary type as the corresponding field of check table SAPTAB.;The check field in ZTAB must have the same domain as the corresponding field of check table SAPTAB.;The check field in ZTAB must have the same name as the corresponding field of check table SAPTAB.;NULL;NULL;NULL;NULL;NULL;NULL;NULL;0;0;1;0;NULL;NULL;NULL;NULL;NULL;NULL;NULL
348;SAP;Which of the following structures is created when you use a table type to define one of its components?;1;Append structure;Deep structure;Flat structure;Nested structure;NULL;NULL;NULL;NULL;NULL;NULL;NULL;0;1;0;0;NULL;NULL;NULL;NULL;NULL;NULL;NULL
349;SAP;What can you enhance using BAdIs?;3;Data elements;Menus;Screens;Database tables;Source code;NULL;NULL;NULL;NULL;NULL;NULL;0;1;1;0;1;NULL;NULL;NULL;NULL;NULL;NULL
350;SAP;You have to overwrite spaces in a string with the letter A.Which of the following statements can you use?;3;SHIFT LEFT;OVERLAY;TRANSLATE;CONDENSE;REPLACE;NULL;NULL;NULL;NULL;NULL;NULL;0;1;1;0;1;NULL;NULL;NULL;NULL;NULL;NULL
351;SAP;You use Unified Modelling language (UML) to design your classes. You want to describe the message exchange between objects. Which diagram can you use?;1;Object diagram;Class diagram;Component diagram;Sequence diagram;NULL;NULL;NULL;NULL;NULL;NULL;NULL;0;0;0;1;NULL;NULL;NULL;NULL;NULL;NULL;NULL
352;SAP;Which of the following transactions are integrated in the ABAP workbench tools?;2;Overview of job selection (SM37);Class builder (SE24);ABAP editor (SE38);Process overview (SM50);NULL;NULL;NULL;NULL;NULL;NULL;NULL;0;1;1;0;NULL;NULL;NULL;NULL;NULL;NULL;NULL
353;SAP;Which of the following predefined ABAP types is incomplete?;1;F;P;XSTRING;STRING;NULL;NULL;NULL;NULL;NULL;NULL;NULL;0;1;0;0;NULL;NULL;NULL;NULL;NULL;NULL;NULL
354;SAP;What do enhancement spots manage?;3;Implicit enhancement points;Classic BAdIs;Explicit enhancement sections;New BAdIs;Explicit enhancement points;NULL;NULL;NULL;NULL;NULL;NULL;0;0;1;1;1;NULL;NULL;NULL;NULL;NULL;NULL
355;SAP;You are using the new debugger and you want to change the content of an internal table.Which actions are allowed?;3;Delete the entire contents of a table.;Change row content and press Save (<CTRL> + S).;Delete table from memory.;Delete the selected rows.;Change row content and press Enter (<ENTER>).;NULL;NULL;NULL;NULL;NULL;NULL;1;0;0;1;1;NULL;NULL;NULL;NULL;NULL;NULL
356;SAP;When would you call the RFC function module synchronously?;2;During queue processing;During interactive communication;During unidirectional communication;During two-way communication;NULL;NULL;NULL;NULL;NULL;NULL;NULL;1;0;0;1;NULL;NULL;NULL;NULL;NULL;NULL;NULL
357;SAP;Which hook method exists for all controller types?;1;wddoonclose( );wddoinit( );wddobeforenavigation( );wddoonopen( );NULL;NULL;NULL;NULL;NULL;NULL;NULL;0;1;0;0;NULL;NULL;NULL;NULL;NULL;NULL;NULL
358;SAP;What are the declarative statements used to define the selection?;3;PARAMETERS;SELECT-OPTIONS;SELECTION-SCREEN;None of the above;NULL;NULL;NULL;NULL;NULL;NULL;NULL;1;1;1;0;NULL;NULL;NULL;NULL;NULL;NULL;NULL
359;SAP;Which of the following values are replaceable in debugger mode?;1;Constants;Variables;Table names;Field names;NULL;NULL;NULL;NULL;NULL;NULL;NULL;0;1;0;0;NULL;NULL;NULL;NULL;NULL;NULL;NULL
360;SAP;With what can you simulate multiple inheritance?;1;REDEFINITION;INHERITING FROM;INTERFACES;CLASS CATEGORY;NULL;NULL;NULL;NULL;NULL;NULL;NULL;0;0;1;0;NULL;NULL;NULL;NULL;NULL;NULL;NULL
361;SAP;You created a class by inheriting from a superclass. The superclass contains a public instance method do_something. You want to redefine method do_something. What must you do?;1;Change the visibility of the method to PROTECTED.;Declare the method FINAL.;Call the implementation in the superclass.;Leave the signature of the method unchanged.;NULL;NULL;NULL;NULL;NULL;NULL;NULL;0;0;0;1;NULL;NULL;NULL;NULL;NULL;NULL;NULL
362;SAP;A user runs an ABAP program, enters an incorrect value on the selection screen, and chooses Execute. Which event block must send the error message in order to display the selection screen again?Please choose the correct answer;NULL;AT SELECTION-SCREEN;AT SELECTION-SCREEN OUTPUT;AT SELECTION-SCREEN ON HELP-REQUEST;AT SELECTION-SCREEN ON VALU E-REQUEST;NULL;NULL;NULL;NULL;NULL;NULL;NULL;1;0;0;0;NULL;NULL;NULL;NULL;NULL;NULL;NULL
363;SAP;Which of the following are valid combinations of event visibility and handler method visibility?;2;Public event and protected handler;Protected event and public handler;Private event and public handler;Private event and private handler;NULL;NULL;NULL;NULL;NULL;NULL;NULL;1;0;0;1;NULL;NULL;NULL;NULL;NULL;NULL;NULL
364;SAP;How do you create lock objects and lock modules for use in ABAP programs that access the database?;1;Use the Function Builder to create the lock modules and the lock objects;Use the ABAP dictionary to create the lock objects. Use the function builder to create the lock modules;Use the Function Builder to create the lock modules. The lock objects are created in the program logic;Use the ABAP Dictionary to create the lock objects. The lock modules are created automatically;NULL;NULL;NULL;NULL;NULL;NULL;NULL;0;0;0;1;NULL;NULL;NULL;NULL;NULL;NULL;NULL
365;SAP;What are the prerequisites when creating an append structure for a standard SAP table?;2;The fields in the append structure should star with YY or ZZ;The table cannot have any fields of type FLTP;The table must be copied before the append structure can be created;The enhancement category of the table is NOT set to Not enhacable;NULL;NULL;NULL;NULL;NULL;NULL;NULL;1;0;0;1;NULL;NULL;NULL;NULL;NULL;NULL;NULL
366;SAP;What types of changes to the repository does SAP provide?;3;Deployments from SDN.SAP.COM;Enhancement Packages;SAP Notes;Transports;Support Packages;NULL;NULL;NULL;NULL;NULL;NULL;0;1;1;0;1;NULL;NULL;NULL;NULL;NULL;NULL
367;SAP;What can be exposed in the component interface of a Web dynpro component?;1;Custom methods of the component controller;Context nodes of WINDOW controllers;Standard hook methods of the component controller;Public attributes of WINDOW controllers;NULL;NULL;NULL;NULL;NULL;NULL;NULL;1;0;0;0;NULL;NULL;NULL;NULL;NULL;NULL;NULL
368;SAP;What parameters can you set when you run the Code Inspector?;3;Work process name;Object set name;Background job name;Check variant name;Inspection name;NULL;NULL;NULL;NULL;NULL;NULL;0;1;0;1;1;NULL;NULL;NULL;NULL;NULL;NULL
369;SAP;The Internet Communication Manager (ICM);1;Replaced SAP ITS.;Allows SAP NetWeaver Application Server to process HTTP requests.;Allows the ABAP stack and the Java stack to exchange data.;Can not replaced SAP ITS.;NULL;NULL;NULL;NULL;NULL;NULL;NULL;0;1;0;0;NULL;NULL;NULL;NULL;NULL;NULL;NULL
370;SAP;Which of the following statements about the Object Navigator are true?;4;ABAP programs can be displayed and edited in the Object Navigator.;Screens can be displayed and edited in the Object Navigator.;Menus can be displayed and edited in the Object Navigator.;You can create BAdI implementations in the Object Navigator.;You can create customer projects (Transaction CMOD) in the Object Navigator.;The ABAP Dictionary can be maintained in the Object Navigator.;NULL;NULL;NULL;NULL;NULL;1;1;1;0;0;1;NULL;NULL;NULL;NULL;NULL
371;SAP;How would you define a method of an ABAP class to prevent this method from being available in a subclass?;1;Final;Private;Abstract;Protected;NULL;NULL;NULL;NULL;NULL;NULL;NULL;0;1;0;0;NULL;NULL;NULL;NULL;NULL;NULL;NULL
372;SAP;You are asked to enhance the GUI status of an SAP standard application.How do you identify which menu exit function code you can use?;1;It starts with a dollar ($).;It starts with a plus (+).;It starts with an ampersand (&).;It starts with an asterisk (*).;NULL;NULL;NULL;NULL;NULL;NULL;NULL;0;1;0;0;NULL;NULL;NULL;NULL;NULL;NULL;NULL
373;SAP;What is the default length of the type P data type?;1;1;8;42370;64;NULL;NULL;NULL;NULL;NULL;NULL;NULL;0;1;0;0;NULL;NULL;NULL;NULL;NULL;NULL;NULL
374;SAP;What type of ABAP Dictionary view is implemented as an INNER JOIN?;1;Database view;Projection view;Help view;Maintenance view;NULL;NULL;NULL;NULL;NULL;NULL;NULL;1;0;0;0;NULL;NULL;NULL;NULL;NULL;NULL;NULL
375;SAP;Which actions release a lock object (with a default value for _SCOPE)?;5;COMMIT WORK;ROLLBACK WORK;The display of an SAP screen;The display of a dialog message type E;The display of a dialog message type A;ENQUEUE_;DEQUEUE_;A call to a function module;A CALL TRANSACTION;A SUBMIT;An /n in the command field;1;1;0;0;1;0;1;0;0;0;1
376;SAP;ABAP is a programming language that;4;Executes on all three levels of the three-tier architecture.;Controls the business logic.;Processes and formats data.;Interacts with the user.;Separates program code from language text.;NULL;NULL;NULL;NULL;NULL;NULL;0;1;1;1;1;NULL;NULL;NULL;NULL;NULL;NULL
377;SAP;You write a report that displays mass data in a table using the ALV Grid Control. Which of the following functions can you offer to the user without doing any specific programming?;2;Sort and filter the data by any column;Convert currency amount columns;Display details by double-clicking on a row;Change column width and sequence;NULL;NULL;NULL;NULL;NULL;NULL;NULL;1;0;0;1;NULL;NULL;NULL;NULL;NULL;NULL;NULL
378;SAP;Which of the following standard hook methods exist in all Web Dynpro controllers?;2;Wddoinit;Wddoafteractions;Wddobeforenavigation;Wddoexit;NULL;NULL;NULL;NULL;NULL;NULL;NULL;1;0;0;1;NULL;NULL;NULL;NULL;NULL;NULL;NULL
379;SAP;When you add programming logic to your ABAP program that checks authorizations,which of the following do you have to create?;2;An authorization object;An authorization profile;An authorization Access;An authorization role;NULL;NULL;NULL;NULL;NULL;NULL;NULL;1;0;0;1;NULL;NULL;NULL;NULL;NULL;NULL;NULL
380;SAP;You want to create a transparent table in the ABAP dictionary.When the table is physically created in the database?;1;When you run the database utility transaction (SE14);When you save the table;When you insert the table name and select create;When you activate the table;NULL;NULL;NULL;NULL;NULL;NULL;NULL;0;0;0;1;NULL;NULL;NULL;NULL;NULL;NULL;NULL
381;SAP;An ABAP program processes the following expression:r = a / b + cWhich of the following data declarations would cause the runtime environment to use fixed-point arithmetic for the above expression?;1;DATA: r TYPE f, a TYPE iVALUE 201, b TYPE iVALUE 200, c TYPE f.;DATA: r TYPE p DECIMALS 2, a TYPE iVALUE 201, b TYPE iVALUE 200, c TYPE p.;DATA: r TYPE p DECIMALS 2, a TYPE iVALUE 201, b TYPE iVALUE 200, c TYPE f.;DATA: r type p, a type iVALUE 201, b type iVALUE 200, c type i.;NULL;NULL;NULL;NULL;NULL;NULL;NULL;0;1;0;0;NULL;NULL;NULL;NULL;NULL;NULL;NULL
382;SAP;Which must a search help do?;4;Use a table or a view for data selection;Determine the values for selection by the user;Have a dialog with the user;Allow the user to select a response;Be used from a screen;NULL;NULL;NULL;NULL;NULL;NULL;0;1;1;1;1;NULL;NULL;NULL;NULL;NULL;NULL
