ID;type;description;nbAns;Answer1;Answer2;Answer3;Answer4;Answer5;Answer6;Answer7;Answer8;Answer9;Answer10;Answer11;Valid1;Valid2;Valid3;Valid4;Valid5;Valid6;Valid7;Valid8;Valid9;Valid10;Valid11
230;SAP;"""You have been asked by a customer to develop Open SQL code to convert the value of argument """"arg"""" into the ABAP Dictionary type specified.""Which SQL syntax do you use to meet this requirement?";1;CASTING(arg AS type);CAST(arg AS type);CASTING(arg FOR type);CAST(arg FOR type);NULL;NULL;NULL;NULL;NULL;NULL;NULL;0;1;0;0;NULL;NULL;NULL;NULL;NULL;NULL;NULL
231;SAP;Which of the following is a true statement?;3;A package can be nested.;All customer repository objects have to be assigned to a package.;Packages use interfaces and visibility to make their elements visible to other packages.;The transport layer is a mandatory input field for the package.;NULL;NULL;NULL;NULL;NULL;NULL;NULL;1;1;1;0;NULL;NULL;NULL;NULL;NULL;NULL;NULL
232;SAP;What are characteristics of a hashed internal table?;2;It can be accessed using the key.;It must have a unique key.;It can have a non-unique key.;It can be accessed using the index.;NULL;NULL;NULL;NULL;NULL;NULL;NULL;1;1;0;0;NULL;NULL;NULL;NULL;NULL;NULL;NULL
233;SAP;Each button on a Dynpro (screen) requires the assignment of a functioncode. This function code;1;Is used to define global variables that receive a value when the button is clicked.;Can be used to identify when the button is clicked by looking for the function code in the screens OK_CODE field.;Prevents the function code from be assigned to a menu item.;Prevents the function code from be assigned to a category item.;NULL;NULL;NULL;NULL;NULL;NULL;NULL;0;1;0;0;NULL;NULL;NULL;NULL;NULL;NULL;NULL
234;SAP;Each ABAP program starts with an introductory statement. Which statements are correct? ;2;The introductory statement must be the first line in the program.;The introductory statement must be the first statement in the program.;The introductory statement must never be modified.;The introductory statement can be modified.;NULL;NULL;NULL;NULL;NULL;NULL;NULL;0;1;0;1;NULL;NULL;NULL;NULL;NULL;NULL;NULL
235;SAP;Which of the following characters is the first of a menu exit function code?;1;-;&;+;*;NULL;NULL;NULL;NULL;NULL;NULL;NULL;0;0;1;0;NULL;NULL;NULL;NULL;NULL;NULL;NULL
236;SAP;What does SAP recommend that you use a hashed table?;1;When a table must be accessible by both index and key;When a table must be sorted automatically by key in ascending order;When a table is very large and you want to access the table by key only;When a table is very large and you want to access the table by index only.;NULL;NULL;NULL;NULL;NULL;NULL;NULL;0;0;1;0;NULL;NULL;NULL;NULL;NULL;NULL;NULL
237;SAP;You write a program that updates a data record in the data base using the following statement:UPDATE scar FROM Is_scarr.Which of the following tasks does the Database Interface perform?;2;It restricts the access to the log-on client;It checks the authorization of the current user;It applies a logical lock to the updated data record.;It translates the statement to native SQL;NULL;NULL;NULL;NULL;NULL;NULL;NULL;0;0;1;1;NULL;NULL;NULL;NULL;NULL;NULL;NULL
238;SAP;Which of the following steps are required to set up a shared memory area?;3;Generate an area root class;Declare a catalog object;Set the root object;Enable multiple versions of an area root class;Call the attach_for_write method of area root class;NULL;NULL;NULL;NULL;NULL;NULL;1;0;1;0;1;NULL;NULL;NULL;NULL;NULL;NULL
239;SAP;In addition to the primary key of an internal table, how many secondary indexes can you define for an internal table?;1;15;0;1;10;NULL;NULL;NULL;NULL;NULL;NULL;NULL;1;0;0;0;NULL;NULL;NULL;NULL;NULL;NULL;NULL
240;SAP;In which sequence are the following ABAP Events triggered?;1;"1. START-OF-SELECTI;1. AT SELECTION-SCRE";"1. INITIALIZATI;1. INITIALIZATI";NULL;NULL;NULL;NULL;NULL;NULL;NULL;0;0;0;0;NULL;NULL;NULL;NULL;NULL;NULL;NULL;;
241;SAP;What transactions can be used to carry out modification adjustments after a system upgrade?;2;SPAD;SPDD;SPAU;SPAU_ENH;NULL;NULL;NULL;NULL;NULL;NULL;NULL;0;1;1;0;NULL;NULL;NULL;NULL;NULL;NULL;NULL
242;SAP;You perform an update task using update function modules and detect an error in the program that calls the update function modules. Which statement can be used to discard all update requests for the current SAP LUW?;2;EXIT.;ROLLBACK WORK.;MESSAGE axxx(nnn).;MESSAGE exxx(nnn).;DELETE UPDATE.;NULL;NULL;NULL;NULL;NULL;NULL;0;1;1;0;0;NULL;NULL;NULL;NULL;NULL;NULL
243;SAP;You define database view A and maintenance view B in the ASAP Dictionary. What restrictions apply to these views?;2;The tables joined in B must have foreign key relationships.;Only A can be used in the FROM clause of a SELECT statement.;The tables joined in A must have foreign key relationships.;The join type of both A and B is an inner join;NULL;NULL;NULL;NULL;NULL;NULL;NULL;1;1;0;0;NULL;NULL;NULL;NULL;NULL;NULL;NULL
244;SAP;Which of the following program types can contain screens?;3;Interface pools;Module pools;Executable programs;Function groups;Class pools;NULL;NULL;NULL;NULL;NULL;NULL;0;1;1;1;0;NULL;NULL;NULL;NULL;NULL;NULL
245;SAP;What can be defined using an implicit enhancement option?;3;Replacements for global SAP methods;Additional attributes in global SAP classes;Replacement for SAP function modules;Additional parameters in SAP function modules;Additional exceptions in SAP function modules;NULL;NULL;NULL;NULL;NULL;NULL;1;1;0;1;0;NULL;NULL;NULL;NULL;NULL;NULL
246;SAP;A class is defined as follows:CLASS my_class DEFINITION. PUBLIC SECTION.METHODS do_something. EVENTS state_changed.CLASS-METHODS static1. PRIVATE SECTION.TYPES t table TYPE STANDARD TABLE OF t001 WITH NON-UNIQUE DEFAULT KEY.CONSTANTS gc_const TYPE IVALUE 1.ENDCLASS.Which components of the class can static method static1 address directly?;2;The do_something method.;The t_table type.;The state_changed event.;The gc_const constant;NULL;NULL;NULL;NULL;NULL;NULL;NULL;0;1;0;1;NULL;NULL;NULL;NULL;NULL;NULL;NULL
247;SAP;You build a dialog screen with an input field in an ABAP program.How do you ensure that the contents of the screen field can be accessed in the program?;1;Enter the name of a data object in the Parameter ID attribute of the screen field;Define a data object in the program with the same name as the screen field;Use a MOVE statement in a PAI module to copy the data to a data object;Use the GET statement in the program to transport the data from the screen field;NULL;NULL;NULL;NULL;NULL;NULL;NULL;0;1;0;0;NULL;NULL;NULL;NULL;NULL;NULL;NULL
248;SAP;Which of the following are key capabilities of SAP NetWeaver?;3;Supply Chain Management;Information Integration;People Integration;Application Platform;Enterprise Resource Planning;NULL;NULL;NULL;NULL;NULL;NULL;0;1;1;1;0;NULL;NULL;NULL;NULL;NULL;NULL
249;SAP;How do you program an input validation on a selection screen that allows users to correct their input?Please choose the correct answer.;NULL;Implement the check at the event AT SELECTION-SCREEN OUTPUT. In case of an input error, a type E MESSAGE must be displayed.;Implement a check at the event AT SELECTION-SCREEN. In case of an input error, a type E;MESSAGE must be displayed.;Implement the check at the event END-OF-SELECTION. In case of an input error, a type E MESSAGE must be displayed.;Implement the check at the event AT SELECTION-SCREEN. In case of an input error, a type A MESSAGE must be displayed.;NULL;NULL;NULL;NULL;NULL;NULL;0;1;0;0;0;NULL;NULL;NULL;NULL;NULL;NULL
250;SAP;You have declared a sorted internal table with the columns A, B, C, and D. The key consists of columns A, B, and C, in this order.Which combination of columns in the WHERE clause of a LOOP statement allows the system to optimize the access to the table?;2;A, B, C, and D;C and D;A and B;B and C;NULL;NULL;NULL;NULL;NULL;NULL;NULL;1;0;1;0;NULL;NULL;NULL;NULL;NULL;NULL;NULL
251;SAP;When you define local classes in ABAP, which syntactical sequence must you follow?;1;PUBLIC SECTION, PROTECTED SECTION, PRIVATE SECTION;PRIVATE SECTION, PROTECTED SECTION, PUBLIC SECTION;The order doesnt matter.;The order is handled automatically.;NULL;NULL;NULL;NULL;NULL;NULL;NULL;1;0;0;0;NULL;NULL;NULL;NULL;NULL;NULL;NULL
252;SAP;Your program uses the class CL_GUI_ALV_GRID to generate a classic ALV Grid ControlWhat do you need in your program to react to a use double-clicking a row in the ALV Grid?;3;A method call to create the event handler;A SET HANDLER statement to register the handler to the event;A handler method for the double_click event;A method call to refresh the display;A handler class;NULL;NULL;NULL;NULL;NULL;NULL;0;1;1;0;1;NULL;NULL;NULL;NULL;NULL;NULL
253;SAP;What is mandatory for automatic data transport between a variable and an input field on a classical screen (dynpro)?;1;The variable must be declared using the DATA statement.;The property OUTPUT of the input field must be set.;The variable must be declared using the TABLES statement.;The name of the variable and the name of the input field must be identical.;NULL;NULL;NULL;NULL;NULL;NULL;NULL;0;0;0;1;NULL;NULL;NULL;NULL;NULL;NULL;NULL
254;SAP;Which of the following are incomplete ASAP pre-defined data types?;3;x;P;D;N;T;NULL;NULL;NULL;NULL;NULL;NULL;1;1;0;1;0;NULL;NULL;NULL;NULL;NULL;NULL
255;SAP;You can use the logical expression IS SUPPLIED for any formal parameter passed to which modularization unit? ;3;Subroutine (FORM routine);Function module;Static method;Instance method;NULL;NULL;NULL;NULL;NULL;NULL;NULL;0;1;1;1;NULL;NULL;NULL;NULL;NULL;NULL;NULL
256;SAP;What pre-defined ABAP data type is deep?;1;DECFLOAT34;STRING;X;N;NULL;NULL;NULL;NULL;NULL;NULL;NULL;0;1;0;0;NULL;NULL;NULL;NULL;NULL;NULL;NULL
257;SAP;You want to translate dynamic text in a web dynpro. From which abstract class should you inherit?;1;CL_WD_CONTEXT_SERVICES;CL_WD_COMPONENT_ASSISTANCE;CL_WD_COMPONENT_SERVICES;CL_WD_CONFIGURATION_MODEL;NULL;NULL;NULL;NULL;NULL;NULL;NULL;0;1;0;0;NULL;NULL;NULL;NULL;NULL;NULL;NULL
258;SAP;You implemented a subclass that inherits the instance constructor from it superclassWhat can you do with the inherited constructor?Note: Answers of this question are not verified by our experts, please study yourself and select the appropriate answers.;2;Create several implementations;Change the name;Change the signature;Redefine the implementation;NULL;NULL;NULL;NULL;NULL;NULL;NULL;0;0;1;1;NULL;NULL;NULL;NULL;NULL;NULL;NULL
259;SAP;Is it possible to have multiple active implementations of business add-ins at a time? ;2;It can have multiple active implementations if the Multiple use checkbox is selected.;It cannot have a multiple active implementation.;It can have multiple implementations if the Filter-Depend. checkbox is selected.;It can have a multiple active implementation.;NULL;NULL;NULL;NULL;NULL;NULL;NULL;1;0;1;0;NULL;NULL;NULL;NULL;NULL;NULL;NULL
260;SAP;What ABAP statements can you use to create an instance of the class CL_GUI_CUSTOM_CONTAINER in an ABAP program?;1;DATA: go_container TYPE REF TO CL_GUI_CUSTOM_CONTAINER.;CREATE DATA go_container;DATA: go_container TYPE CL_GUI_CUSTOM_CONTAINER.;CREATE OBJECT go_container.;DATA: go_container TYPE CL_GUI_CUSTOM_CONTAINER.;CREATE DATA go_container;DATA: go_container TYPE REF TO CL_GUI_CUSTOM_CONTAINER.;CREATE OBJECT go_container..;NULL;NULL;NULL;0;0;0;0;0;0;1;0;NULL;NULL;NULL
261;SAP;What is the predefined reference variable used in ABAP OO to address the object itself?;1;THIS;SUPER;SELF;ME;NULL;NULL;NULL;NULL;NULL;NULL;NULL;0;0;0;1;NULL;NULL;NULL;NULL;NULL;NULL;NULL
262;SAP;Value help can be supplied from which of the following? Please select all the correct answers that apply.;NULL;Process On Value request;Search help for a screen field;Search help for table or structure fields;Search help for a check table;Search help from a text table;Key values of a check table;Search help for a data element;Fixed values;NULL;NULL;NULL;1;1;1;1;1;1;1;1;NULL;NULL;NULL
263;SAP;What do you need to have in your program to respond to the DOUBLE_CLICK event raised by an instance of the CL_GUI_ALV_GRID class?;3;A SET HANDLER statement to register the handler to the event;A method to read the registration table;A handler method for the event;A CATCH statement to capture the event;A handler class;NULL;NULL;NULL;NULL;NULL;NULL;1;0;1;0;1;NULL;NULL;NULL;NULL;NULL;NULL
264;SAP;What is variable-length structure called?;1;Nested link structure;Nested structure;Flat structure;Link structure;NULL;NULL;NULL;NULL;NULL;NULL;NULL;0;1;0;0;NULL;NULL;NULL;NULL;NULL;NULL;NULL
265;SAP;You want to select data from two tables and store the result in as structure.Table PARTNER contains the fields PART_ID and KIND.Table CONTRACT contains the fields CONT_ID, CONT_TYPE and DIVISION.The structure is defined as followsDATA: BEGIN OF wa_result,Part_id type partner-part_id, cont_id type contract-cont_id,Cont_type TYPE contract-cont_type,END of wa_result,Lt_result type table of wa_result.How can you replace the following SELECT statement with an outer join?SELECT part_id from partner INTO wa_result WHERE kind = Residential.SELECT cont_id from CONTRACT into wa_result-cont_id WHERE part EQ wa_partner-part_id And DIVISION eq Water.Append wa_result to lt_result.ENDSELECT.If sy-subrc<>0. CLEAR wa_result-cont_idAPPEND wa_result TO lt_result. ENDIF.ENDSELECT.;1;SELECT part_idcont_id from partner LEFT JOIN contract on partner-part_id = contract-part_id AND partner-kind EQ Residential INTO CORRESPONDING FIELDS OF TABLE lt_result WHERE division eq Water.;SELECT part_idcont_id from partner AS A LEFT JOIN contract AS b ON a~part_id = b~part_id INTO CORRESPONDING FIELDS OF TABLE lt_result WHERE kind = Residential and AND division EQ Water.;SELECT part_idcont_id from partner AS A LEFT JOIN contract AS b ON a~part_id = b~part_id AND b~division EQ Water INTO TABLElt_result WHERE kind = Residential;SELECT part_idcont_id from partner LEFT JOIN contract on partner-part_id = contract-part_id AND contract-division EQ Water INTO TABLE lt_result WHERE kind EQ Residential.;NULL;NULL;NULL;NULL;NULL;NULL;NULL;0;1;0;0;NULL;NULL;NULL;NULL;NULL;NULL;NULL
266;SAP;Which of the following ABAP standard types are incomplete?;2;N;STRING;F;X;NULL;NULL;NULL;NULL;NULL;NULL;NULL;1;0;0;1;NULL;NULL;NULL;NULL;NULL;NULL;NULL
267;SAP;Which are the functions of the ABAP dispatcher?;3;It requests the data from the database or the buffers.;It integrates the presentation layer.;It saves the processing requests in request queues.;It distributes the requests among the work processes.;It performs a roll-in and roll-out of user context.;NULL;NULL;NULL;NULL;NULL;NULL;0;1;1;1;0;NULL;NULL;NULL;NULL;NULL;NULL
268;SAP;Which of the following Data Types are allowed in ABAP?;2;DECFLOAT64;DECFLOAT16;DECFLOAT34;DECFLOAT32;NULL;NULL;NULL;NULL;NULL;NULL;NULL;0;1;1;0;NULL;NULL;NULL;NULL;NULL;NULL;NULL
269;SAP;You need to perform a downcast. What should you do?;2;Catch the exception CX_SY_MOVE_CAST_ERROR;Use the operator =.;Use the operator ?=;Assign a subclass reference to a superclass reference;NULL;NULL;NULL;NULL;NULL;NULL;NULL;1;0;1;0;NULL;NULL;NULL;NULL;NULL;NULL;NULL
270;SAP;In an ABAP program you have the following code sequence:DATA var TYPE n LENGTH 1.FIELD SYMBOLS <fs> TYPE cASSIGN var TO <fs> CASTINGWhich type is used to cast the assigned memory area?;1;The type of <fs>;The default type STRING;The type of var;The default type I;NULL;NULL;NULL;NULL;NULL;NULL;NULL;0;0;1;0;NULL;NULL;NULL;NULL;NULL;NULL;NULL
271;SAP;Which of the following statements can you use to setup checkpoints in an ABAP program?;3;BREAK_POINT;ASSERT;BREAK;CHECK;LOG-POINT;NULL;NULL;NULL;NULL;NULL;NULL;1;1;0;0;1;NULL;NULL;NULL;NULL;NULL;NULL
272;SAP;What must exist before you can create a new transportable function module?;3;Module pool;Change request;Type group;Package;Function group;NULL;NULL;NULL;NULL;NULL;NULL;0;1;0;1;1;NULL;NULL;NULL;NULL;NULL;NULL
273;SAP;To reserve an area on the screen for an ALV Grid Control, you must do the following:;1;Create an object (instantiate the object) of the class CL_GUI_CUSTOM_CONTAINER;Create an object (instantiate the object) of the class CL_GUI_ALV_GRID;Create an object (instantiate the object) of the class CL_SALV_TABLE;Use the Screen Painter;NULL;NULL;NULL;NULL;NULL;NULL;NULL;0;0;0;1;NULL;NULL;NULL;NULL;NULL;NULL;NULL
274;SAP;Which ABAP Dictionary object can reference a domain?;1;Structure;Database table field;Table type;Data element;NULL;NULL;NULL;NULL;NULL;NULL;NULL;0;0;0;1;NULL;NULL;NULL;NULL;NULL;NULL;NULL
275;SAP;Which message types behave the same regardless of the context in which they are called?;2;A;E;I;S;W;X;NULL;NULL;NULL;NULL;NULL;1;0;0;0;0;1;NULL;NULL;NULL;NULL;NULL
276;SAP;Which controller types can exist within a Web Dynpro component?;3;Window controller;User controller;Application controller;View controller;Component controller;NULL;NULL;NULL;NULL;NULL;NULL;1;0;0;1;1;NULL;NULL;NULL;NULL;NULL;NULL
277;SAP;Which of the following statements create a data object?;3;CLASS;TYPES;PARAMETERS;CLASS-DATA;CONSTANTS;NULL;NULL;NULL;NULL;NULL;NULL;0;0;1;1;1;NULL;NULL;NULL;NULL;NULL;NULL
278;SAP;You have 2 objects: O1 of type class C1 and O2 of type class C2.Class C2 is a subclass of class C1. Which of the following statements implements an up cast?;1;MOVE O1 ?TO O2.;O2 ?= O1.;MOVE O1 TO O2.;O1 = O2.;NULL;NULL;NULL;NULL;NULL;NULL;NULL;0;0;0;1;NULL;NULL;NULL;NULL;NULL;NULL;NULL
279;SAP;Which of the following repository objects can you maintain in the ABAP Workbench?;3;Function modules;Internal tables;Business functions;Transparent tables;Module pools;NULL;NULL;NULL;NULL;NULL;NULL;1;0;0;1;1;NULL;NULL;NULL;NULL;NULL;NULL
280;SAP;You are making changes to a program that already has transaction code ZZZZ linked to it. Your colleague is testing transaction code ZZZZ in the same system.When does the changed version of the program become visible to your colleague via transact on code ZZZZ?;1;When you execute the program from the ABAP Editor;When you save the program;When the syntax of the program is correct;When you activate the program;NULL;NULL;NULL;NULL;NULL;NULL;NULL;0;0;0;1;NULL;NULL;NULL;NULL;NULL;NULL;NULL
281;SAP;You call a lock module.Which exceptions could the lock module raise when a logical lock CANNOT be set?;2;FOREIGN_LOCK;CX_SY_DATA_ACCESS_ERROR;CX_SY_OPEN_SQL_ERROR;SYSTEM_FAILURE;NULL;NULL;NULL;NULL;NULL;NULL;NULL;1;0;0;1;NULL;NULL;NULL;NULL;NULL;NULL;NULL
282;SAP;Function modules provide which types of parameters?;4;Output;Input/output (changing);Return values;Input;Exceptions;NULL;NULL;NULL;NULL;NULL;NULL;1;1;0;1;1;NULL;NULL;NULL;NULL;NULL;NULL
283;SAP;You write the following ABAP statement:SELECT SINGLE carrid, connid, cityfrom, cityto FROM spfliINTO @gs_spfliWHERE carrid = @pa_car AND connid = @pa_con.How are the selected fields placed into target structure gs_spfli?;1;Into fields with the same name and same type;From left to right;Into fields with the same name;Into fields with the same type;NULL;NULL;NULL;NULL;NULL;NULL;NULL;0;1;0;0;NULL;NULL;NULL;NULL;NULL;NULL;NULL
284;SAP;Which data type is allowed for the reference field of the Currency field?;1;DEC;CURR;UNIT;CUKY;NULL;NULL;NULL;NULL;NULL;NULL;NULL;0;0;0;1;NULL;NULL;NULL;NULL;NULL;NULL;NULL
285;SAP;What does the Refactoring Assistant allow you to do?;2;Move between classes and interfaces;Move components between superclasses and subclasses;Rename all subclasses of a method;Rename all occurrences of a method;NULL;NULL;NULL;NULL;NULL;NULL;NULL;1;1;0;0;NULL;NULL;NULL;NULL;NULL;NULL;NULL
286;SAP;In which modularization units can you use parameters?;3;Methods;Event blocks such as START-OF-SELECTION;Dialog modules such as PBO modules;Function modules;Subroutines;NULL;NULL;NULL;NULL;NULL;NULL;1;0;0;1;1;NULL;NULL;NULL;NULL;NULL;NULL
287;SAP;Which of the following tasks does the BADI implementing class perform?;1;Sequencing;Filtering;Inserting;Deleting;NULL;NULL;NULL;NULL;NULL;NULL;NULL;0;1;0;0;NULL;NULL;NULL;NULL;NULL;NULL;NULL
288;SAP;A transport company keeps track of this availability in two tables, table VEHICLES and table TRANSPORT. To accept a new transport of a certain capacity must be found in table VEHICLES. If a record is found, a record is created in table TRANSPORT. The capacity is then adjusted in table VEHICLES.\\You have four function modules at your disposal.UPD_VEHI_A and UPD_VEHI_B update a matching report in table VEHICLES. If an error occurs both issue a message of type X. If no error occurs only UPD_VEHI_A issues a message of type X. If no error occurs UPD_VEHI_A issues a message of type I.UPD_TRAN_A and UPD_TRAN_B create a single record in table TRANSPORT. If an error occurs both issues a message of type X. If no error occurs only UPD_TRAN_A issues a message of type I.Which of the following function module calls ensures a single logical unit of work?;1;1.UPD_VEHI_A;2.UPD_TRAN_A;1. UPD_TRAN_A;2. UPD_VEHI_B;1.UPD_VEHI_A;2.UPD_TRAN_B;1. UPD_TRAN_B;2. UPD_VEHI_B;NULL;NULL;NULL;0;0;0;0;1;0;0;0;NULL;NULL;NULL
289;SAP;You enhance an SAP standard global class by defining a post-method for an SAP method. The original SAP method has an EXPORTING parameter named PAR 1.What type of parameter is PAR 1 in the post-method?Please choose the correct answer;NULL;EXPORTING;RETURNING;CHANGING;IMPORTING;NULL;NULL;NULL;NULL;NULL;NULL;NULL;0;0;1;0;NULL;NULL;NULL;NULL;NULL;NULL;NULL
290;SAP;What is the Web Dynpro programming model is based on?;1;Internet Transaction Server (ITS);Business Server Pages (BSPs);Model View Controller (MVC);Classic Dynpro programming;NULL;NULL;NULL;NULL;NULL;NULL;NULL;0;0;1;0;NULL;NULL;NULL;NULL;NULL;NULL;NULL
291;SAP;In which controller type can you embed a service call?;1;View controller;Interface controller;Configuration controller;Component controller;NULL;NULL;NULL;NULL;NULL;NULL;NULL;0;0;0;1;NULL;NULL;NULL;NULL;NULL;NULL;NULL
292;SAP;Which of the following can you assign a search help to?;3;Data element;Structure component;Domain;Check table;Table type;NULL;NULL;NULL;NULL;NULL;NULL;1;1;0;1;0;NULL;NULL;NULL;NULL;NULL;NULL
293;SAP;Which of the following is an implicit enhancement?;2;Overwrite method;Private method;Protected method;Pre-method;NULL;NULL;NULL;NULL;NULL;NULL;NULL;0;1;1;0;NULL;NULL;NULL;NULL;NULL;NULL;NULL
294;SAP;What will happen at runtime when accessing a buffered table?;1;If data is read from the table buffer, the existing indexes are not used.;Following an update to a buffered record, all table buffers in the system will be updated.;If table data is read using indexes, the table buffer will not be filled.;All SELECT statements will read data from the buffer.;NULL;NULL;NULL;NULL;NULL;NULL;NULL;1;0;0;0;NULL;NULL;NULL;NULL;NULL;NULL;NULL
295;SAP;Which of the following is a true statement?;3;A package can be nested.;All customer repository objects have to be assigned to a package.;Packages use interfaces and visibility to make their elements visible to other packages.;The transport layer is a mandatory input field for the package.;NULL;NULL;NULL;NULL;NULL;NULL;NULL;1;1;1;0;NULL;NULL;NULL;NULL;NULL;NULL;NULL
296;SAP;Which of the following are true statements?;3;Field labels are defined for the domain.;The technical attributes of the data element can be defined by a domain, that is, the data type, the field length, and the number of decimal places.;Reference data types can be used to define the data type of the data element.;You can also select predefined data types to define the data type of the data element.;NULL;NULL;NULL;NULL;NULL;NULL;NULL;0;1;1;1;NULL;NULL;NULL;NULL;NULL;NULL;NULL
297;SAP;Which of the following tools belong to the ABAP Workbench?;3;Screen Painter;Function Builder;Form Builder;Easy Access Menu;Class Builder;NULL;NULL;NULL;NULL;NULL;NULL;1;1;0;0;1;NULL;NULL;NULL;NULL;NULL;NULL
298;SAP;Where should the labels for fields be stored?;1;Domain;Field;Structure;Table;Data element;NULL;NULL;NULL;NULL;NULL;NULL;0;0;0;0;1;NULL;NULL;NULL;NULL;NULL;NULL
299;SAP;You want to move a transport request from the development system to the subsequent system. Which of the following are prerequisites for this?;2;The extended program check must show no warnings.;The transport request must be released;All objects included in the transport request must be activated.;All tasks of the transport request must be assigned to the same user.;NULL;NULL;NULL;NULL;NULL;NULL;NULL;0;1;1;0;NULL;NULL;NULL;NULL;NULL;NULL;NULL
300;SAP;Your selection screen can be modified at which event?;1;AT SELECTION-SCREEN ON <field_name>;AT SELECTION-SCREEN;AT SELECTION-SCREEN OUTPUT;None of the above;NULL;NULL;NULL;NULL;NULL;NULL;NULL;0;0;1;0;NULL;NULL;NULL;NULL;NULL;NULL;NULL
301;SAP;Which of the following are true statements?;3;Table fields can be assigned to a data element.;Table fields can be assigned to an ABAP Dictionary data type directly.;Search helps can be defined for a table field that is assigned to a predefined data type.;A reference table and field are required for fields with the data types QUAN and CURR.;NULL;NULL;NULL;NULL;NULL;NULL;NULL;1;1;0;1;NULL;NULL;NULL;NULL;NULL;NULL;NULL
302;SAP;Which of the following actions can be performed in the Process After Input (PAI) processing block?;1;Set the GUI status of the screen.;Modify screen attributes dynamically.;Set the title bar.;Check the function code.;NULL;NULL;NULL;NULL;NULL;NULL;NULL;0;0;0;1;NULL;NULL;NULL;NULL;NULL;NULL;NULL
303;SAP;Which data element property do you set so that the system logs changes to the content of fields with this data element?;1;Input history;Change document;PARAMETER ID;Documentation;NULL;NULL;NULL;NULL;NULL;NULL;NULL;0;1;0;0;NULL;NULL;NULL;NULL;NULL;NULL;NULL
304;SAP;Which objects can share data through context mapping?;1;Custom controllers and transparent tables;Global classes and component controllers;Component controllers and view controllers;View controller and another view controller;NULL;NULL;NULL;NULL;NULL;NULL;NULL;0;0;1;0;NULL;NULL;NULL;NULL;NULL;NULL;NULL
