ID;type;description;nbAns;Answer1;Answer2;Answer3;Answer4;Answer5;Answer6;Answer7;Answer8;Answer9;Answer10;Answer11;Valid1;Valid2;Valid3;Valid4;Valid5;Valid6;Valid7;Valid8;Valid9;Valid10;Valid11
156;SAP;When starting the Debugger, what circumstance causes the runtime errorDEBUGGING_NOT_POSSIBLE?;1;Starting a non-exclusive mode in a productive system;When more than five sessions are already associated with this login user;When the number of debugging sessions on the server exceeds the value defined by the profile parameter rdisp/wpdbug_max_no;When more than six sessions are already associated with this login user;NULL;NULL;NULL;NULL;NULL;NULL;NULL;1;0;0;0;NULL;NULL;NULL;NULL;NULL;NULL;NULL
157;SAP;You create a function group ZATP. What is the name of the corresponding main program?;1;ZATP;SAPLZATP;SAPMZATP;SAPFZATP;NULL;NULL;NULL;NULL;NULL;NULL;NULL;0;1;0;0;NULL;NULL;NULL;NULL;NULL;NULL;NULL
158;SAP;Which of the following is a true statement? ;3;All transportable objects have to be assigned to a package.;Local repository objects can be transported.;Repository objects and cross-client customization objects are assigned to the workbench request.;Client-specific customization objects are assigned to the customizing request.;Inactive objects can be transported.;NULL;NULL;NULL;NULL;NULL;NULL;1;0;1;1;0;NULL;NULL;NULL;NULL;NULL;NULL
159;SAP;You are required to add customer source code in the SAP delivered object using the new enhancement framework without modification. How can you find the available enhancement?;3;Perform a program-related global search for a customer exit.;Search for a Business Transaction Event in the Customizing tree (transaction SPRO).;Select from the list of application-related BAdIs or enhancement spots in the SAP Application Hierarchy.;Perform a program-related global search for GET BADI.;Select from the list of freely selected BAdIs or enhancement spots in the Repository Information System.;NULL;NULL;NULL;NULL;NULL;NULL;0;0;1;1;1;NULL;NULL;NULL;NULL;NULL;NULL
160;SAP;FORM routines (subroutines) can be used in which program types?;4;Executables;Module pools;Function groups;Class pools;Interface pools;Subroutine pools;Type groups;NULL;NULL;NULL;NULL;1;1;1;0;0;1;0;NULL;NULL;NULL;NULL
161;SAP;Which of the following function types in a GUI status are reserved for internal use?;2;S- SYSTEM;E-EXIT;H-HELP REQUEST;T-TRANSACTION;NULL;NULL;NULL;NULL;NULL;NULL;NULL;1;0;1;0;NULL;NULL;NULL;NULL;NULL;NULL;NULL
162;SAP;Which ABAP statement can make an element visible that you statically defined as invisible?;1;SCREEN-INVISIBLE = 1;SCREEN-ACTIVE = 1;SCREEN-ACTIVE = 0;SCREEN-INVISIBLE = 0;NULL;NULL;NULL;NULL;NULL;NULL;NULL;0;0;0;1;NULL;NULL;NULL;NULL;NULL;NULL;NULL
163;SAP;Which of the following are features of the Context in Web Dynpro?;2;Data is transferred from one Context to another by firing plugs;Every Web Dynpro controller has one Context;Data is shared between controllers through Context mapping;Every Web Dynpro controller has multiple Contexts;NULL;NULL;NULL;NULL;NULL;NULL;NULL;0;1;1;0;NULL;NULL;NULL;NULL;NULL;NULL;NULL
164;SAP;When must a foreign key have domain equality?;1;Always;Never;For a check field;For a text table;NULL;NULL;NULL;NULL;NULL;NULL;NULL;0;0;1;0;NULL;NULL;NULL;NULL;NULL;NULL;NULL
165;SAP;How would you find out if an application program offers a program exit?Please select all the correct answers that apply.;NULL;Search for the character string CUSTOMER-FUNCTION;Use the Repository Information System;Use the Application Hierarchy;Look for a customer exit in the SAP reference IMG within an application area;NULL;NULL;NULL;NULL;NULL;NULL;NULL;1;1;1;1;NULL;NULL;NULL;NULL;NULL;NULL;NULL
166;SAP;You are creating an inspection using the Code Inspector. Which entities can you select for inspection?;3;Contents of an object set;NULL;Contents of a package;Contents of a transport request;Contents of a single object;NULL;NULL;NULL;NULL;NULL;NULL;1;NULL;0;1;1;NULL;NULL;NULL;NULL;NULL;NULL
167;SAP;After which statement will the runtime system initialize the ABAP memory?;1;SUBMIT AND RETURN;CALL TRANSACTION;LEAVE TO TRANSACTION;SUBMIT;NULL;NULL;NULL;NULL;NULL;NULL;NULL;0;0;1;0;NULL;NULL;NULL;NULL;NULL;NULL;NULL
168;SAP;Which statement is used to generically define the data reference variable z1?;1;data z1 type any;data z1 type any table;data z1 type ref to PA0001;data z1 type ref to data;NULL;NULL;NULL;NULL;NULL;NULL;NULL;0;0;0;1;NULL;NULL;NULL;NULL;NULL;NULL;NULL
169;SAP;What features are provided by the database interface?;3;Database independence of application programs;Conversion of Open SQL statements from ABAP statements into the corresponding database;statements;Syntax check of Native SQL commands;Access to SAP table buffers;Data consistency check using foreign key relationships;NULL;NULL;NULL;NULL;NULL;1;1;0;0;1;0;NULL;NULL;NULL;NULL;NULL
170;SAP;Which method of passing parameters is preferred for its performance?;1;Pass by reference;Pass by value;Pass by class;Pass by subclass;NULL;NULL;NULL;NULL;NULL;NULL;NULL;1;0;0;0;NULL;NULL;NULL;NULL;NULL;NULL;NULL
171;SAP;What are the differences between displaying in a full screen and in a container?;2;The full screen requires Dynpro programming.;The container requires the use of an additional object (a container control).;The only difference is that the container name must be specified when creating the ALV object.;Only a full-screen ALV allows the use of event handling.;Only an ALV in a container allows the use of event handling.;Any type of ALV allows the use of event handling.;NULL;NULL;NULL;NULL;NULL;0;1;0;0;0;1;NULL;NULL;NULL;NULL;NULL
172;SAP;What is the best order to provide an event handler for an ALV?;1;Create the ALV, write the handler, register for the event, display the ALV;Register for the event, write the handler, create the ALV, display the ALV;Write the handler, register for the event, create the ALV, display the ALV;Write the handler, create the ALV, register for the event, display the ALV;Write the handler, create the ALV, display the ALV, register for the event;NULL;NULL;NULL;NULL;NULL;NULL;0;0;0;1;0;NULL;NULL;NULL;NULL;NULL;NULL
173;SAP;When analyzing a program, which tasks can you perform using the code inspector?;3;Discover unused variables.;Execute the extended program check;Determine used database tables.;Inspect the memory consumption;Evaluate the time needed for program execution.;NULL;NULL;NULL;NULL;NULL;NULL;1;1;1;0;0;NULL;NULL;NULL;NULL;NULL;NULL
174;SAP;To which of the following you must assign newly created SAP repository objects?;1;Transport task;Function group;Transport request;Package;NULL;NULL;NULL;NULL;NULL;NULL;NULL;0;0;0;1;NULL;NULL;NULL;NULL;NULL;NULL;NULL
175;SAP;The data buffered on each application server;1;Is always the same.;Is never the same.;Depends on the users.;Is does not the same.;NULL;NULL;NULL;NULL;NULL;NULL;NULL;0;0;1;0;NULL;NULL;NULL;NULL;NULL;NULL;NULL
176;SAP;How can you declare an internal table using the transparent table A as its line type?;1;DATA gt_itab TYPE LINE OF a.;DATA gt_itab TYPE REF TO a.;DATA gt_itab TYPE TABLE OF a.;DATA gt_itab TYPE a.;NULL;NULL;NULL;NULL;NULL;NULL;NULL;0;0;1;0;NULL;NULL;NULL;NULL;NULL;NULL;NULL
177;SAP;What is the allowed length of the ABAP Dictionary data type DF16_DEC?;1;The allowed length is between 1 and 15 digits.;The allowed length is 16 digits.;The allowed length is between 0 and 16 digits.;The allowed length is between 0 and 15 digits.;NULL;NULL;NULL;NULL;NULL;NULL;NULL;1;0;0;0;NULL;NULL;NULL;NULL;NULL;NULL;NULL
178;SAP;What type of method is generated automatically by the Web Dynpro Explorer when you assign an action to a buttonUI element?;1;Ordinary method;Event handler method;Supply function;Standard hook method;NULL;NULL;NULL;NULL;NULL;NULL;NULL;0;1;0;0;NULL;NULL;NULL;NULL;NULL;NULL;NULL
179;SAP;Which of the following can you do with the ABAP debugger?;3;Compare data objects.;Change source code.;Analyze memory usage.;Analyze SQL traces.;Analyze internal tables;NULL;NULL;NULL;NULL;NULL;NULL;1;0;1;0;1;NULL;NULL;NULL;NULL;NULL;NULL
180;SAP;What can you create using the ABAP Dictionary?;3;Domains;Type pools;Transparent tables;Field symbols;Internal tables;NULL;NULL;NULL;NULL;NULL;NULL;1;1;1;0;0;NULL;NULL;NULL;NULL;NULL;NULL
181;SAP;Each ABAP program that actually contains executable statements;2;Is divided into processing blocks.;Assigns every executable statement to a processing block regardless of it being in a processing block.;Only assigns executable statements in a processing block to a processing block.;Uses event blocks to trigger events in ABAP.;Has declarative statements outside of processing blocks that are considered local.;Has declarative statements inside of processing blocks that are considered local.;Can be tested from the ABAP Workbench by pressing (F8).;NULL;NULL;NULL;NULL;1;1;0;0;0;0;0;NULL;NULL;NULL;NULL
182;SAP;For which of the following requirements can you implement a functional method?;2;A handler method for an event that has a returning parameter;A method to set an instance attribute with one importing parameter and no other parameters;A factory method that returns an object reference;A private static helper method that returns a single value as the result of an algorithm;NULL;NULL;NULL;NULL;NULL;NULL;NULL;0;0;1;1;NULL;NULL;NULL;NULL;NULL;NULL;NULL
183;SAP;What is the default selection screen number for the ABAP program?;1;1000;100;1100;None of the above;NULL;NULL;NULL;NULL;NULL;NULL;NULL;1;0;0;0;NULL;NULL;NULL;NULL;NULL;NULL;NULL
184;SAP;A function module that has 2 classical exceptions is called with actual parameter values in such a way that both exception conditions are fulfilled. How will the runtime system behave?;1;Both exceptions will be raised. In the calling program, sy-subrc has the value specified for the second except on.;Both exceptions will be raised. In the calling program, sy-subrc has the value specified for the OTHERS option.;No exception will be raised. In the calling program, sy-subrc has the value specified for the OTHERS option.;The first exception that occurs will be raised. In the calling program, sy-subrc has the value specified for the first exception.;NULL;NULL;NULL;NULL;NULL;NULL;NULL;0;0;0;1;NULL;NULL;NULL;NULL;NULL;NULL;NULL
185;SAP;How do you add fields to an SAP-delivered transparent table without modification?;1;Use the database utility to enhance the definition on the database directly.;Add the new fields to the table definition.;Create an append structure containing the new fields.;Define a structure containing the new fields and include it in the table definition.;NULL;NULL;NULL;NULL;NULL;NULL;NULL;0;0;1;0;NULL;NULL;NULL;NULL;NULL;NULL;NULL
186;SAP;What do you have to take into account before you decide to buffer a table?;1;The data read from the buffer may NOT be current;The database server must allow table buffering;The data must always be read from the buffer;The entire table content must be loaded into the table buffer;NULL;NULL;NULL;NULL;NULL;NULL;NULL;1;0;0;0;NULL;NULL;NULL;NULL;NULL;NULL;NULL
187;SAP;When included in a structure, which elementary field types allow the structure to be considered a character-type data object?;4;C;D;F;I;N;STRING;T;X;XSTRING;NULL;NULL;1;1;0;0;1;0;1;0;0;NULL;NULL
188;SAP;You have created a screen on which the user enters data that is to be inserted into table T1. How do you ensure that the content of field F in table T1 is checked against table T2?;1;Create a foreign key for the assigned field of field F of table T1 in table T2 and make table T2 the check table.;Create a foreign key for field F of table T1 and make table T2 the check table.;Create a foreign key for the assigned field of field F of table T1 in table T2 and make table T1 the check table.;Create a foreign key for field F of table T1 and make table T2 the foreign key table;NULL;NULL;NULL;NULL;NULL;NULL;NULL;1;0;0;0;NULL;NULL;NULL;NULL;NULL;NULL;NULL
189;SAP;When are the changes to the VB* table transferred to the database?;1;When the main program is executed;When the enqueue work process is executed;When an update function module is executed;When the update work process is executed;NULL;NULL;NULL;NULL;NULL;NULL;NULL;0;0;0;1;NULL;NULL;NULL;NULL;NULL;NULL;NULL
190;SAP;You are writing a program that uses ABAP class.Which components of the class can you create directly from the program?;1;Only private components;Only protected components;Only public components;All components;NULL;NULL;NULL;NULL;NULL;NULL;NULL;0;0;1;0;NULL;NULL;NULL;NULL;NULL;NULL;NULL
191;SAP;Which statements are true about a class that has granted friendship to another class?;4;The friend has access to private attributes.;The friend has access to protected attributes.;The friend has access to public attributes.;All classes the friend has granted friendship access status to also have the same access.;All classes that inherit from the friend (subclasses) also have the same access.;NULL;NULL;NULL;NULL;NULL;NULL;1;1;1;0;1;NULL;NULL;NULL;NULL;NULL;NULL
192;SAP;How do you use a sorted internal table?;2;You need to specify a key in the table declaration;You can resort the table with SORT;You use APPEND to insert records at the correct position;You can read the records by index or key;NULL;NULL;NULL;NULL;NULL;NULL;NULL;1;0;0;1;NULL;NULL;NULL;NULL;NULL;NULL;NULL
193;SAP;What is the allowed length of the ABAP Dictionary data type DF34_RAW?;1;The allowed length is between 1 and 34 digits.;The allowed length is between 1 and 31 digits.;The allowed length is between 0 and 33 digits.;The allowed length is 34 digits.;NULL;NULL;NULL;NULL;NULL;NULL;NULL;0;0;0;1;NULL;NULL;NULL;NULL;NULL;NULL;NULL
194;SAP;In which database table type is there a one-to-one relationship between the Dictionary table definition and the relevant physical table in the database?;1;Cluster table;Pooled table;Transparent table;Internal table;NULL;NULL;NULL;NULL;NULL;NULL;NULL;0;0;1;0;NULL;NULL;NULL;NULL;NULL;NULL;NULL
195;SAP;Which desktops are part of the new ABAP debugger?;3;Break./Watchpoints;Objects;Session;Desktop 1;List;NULL;NULL;NULL;NULL;NULL;NULL;1;1;0;1;0;NULL;NULL;NULL;NULL;NULL;NULL
196;SAP;You have been asked to review the following expression, which processes character strings:occ = 2What is the expected value of result?;1;1;2;4;6;NULL;NULL;NULL;NULL;NULL;NULL;NULL;0;0;0;1;NULL;NULL;NULL;NULL;NULL;NULL;NULL
197;SAP;The order of fields for a transparent table in the database;1;Needs to match the ABAP Dictionary.;Is created in the order of the ABAP Dictionary.;Is allowed to be different than the ABAP Dictionary.;Is created in the order of the DataDictionary.;NULL;NULL;NULL;NULL;NULL;NULL;NULL;0;0;1;0;NULL;NULL;NULL;NULL;NULL;NULL;NULL
198;SAP;What ABAP Dictionary object allows you to define fixed values?;1;Domain;Lock object;Data element;View;NULL;NULL;NULL;NULL;NULL;NULL;NULL;1;0;0;0;NULL;NULL;NULL;NULL;NULL;NULL;NULL
199;SAP;What is the purpose of the enqueuer work process?;1;It processes update requests.;It processes requests triggered by an active user.;It processes logical locks requests.;It processes requests for a print output;NULL;NULL;NULL;NULL;NULL;NULL;NULL;0;0;1;0;NULL;NULL;NULL;NULL;NULL;NULL;NULL
200;SAP;What is required to fully specify a Table Type in the ABAP Dictionary?;3;Access type;Table key;Table size;Line type;Header line;NULL;NULL;NULL;NULL;NULL;NULL;1;1;0;1;0;NULL;NULL;NULL;NULL;NULL;NULL
201;SAP;DOG is a subclass of ANIMAL. You have created a variable of type ANIMAL that references an instance of the DOG class. Which of the following statements can you use to copy this reference to a new variable of type DOG?;1;MOVE. TO..;MOVE?TO;WRITETO;MOVE-CORRESPONDING TO;NULL;NULL;NULL;NULL;NULL;NULL;NULL;0;1;0;0;NULL;NULL;NULL;NULL;NULL;NULL;NULL
202;SAP;Which SELECT statement will always bypass the SAP table buffers?;1;SELECT  ENDSELECT.;SELECT  SINGLE ;SELECT  INTO TABLE ;SELECT  FOR UPDATE ;NULL;NULL;NULL;NULL;NULL;NULL;NULL;0;0;0;1;NULL;NULL;NULL;NULL;NULL;NULL;NULL
203;SAP;In which order do you implement a new BAdI?;1;Create BAdI Implementation;Create Enhancement Spot Implementation;Create BAdI Implementation;Create Enhancement Project;Create Enhancement Spot Implementation;Create BAdI Implementation;Create Enhancement Project;Create BAdI Implementation;NULL;NULL;NULL;0;0;0;0;1;0;0;0;NULL;NULL;NULL
204;SAP;You always want to check the user authorization for data entered in an input field of a selection screen.Where do you do this?;1;In the event block AT SELECTION-SCREEN;In the event block AT SELECTION-SCREEN OUTPUT;In the event block INITIALIZATION;In the event block AT SELECTION-SCREEN on VALUE-REQUEST;NULL;NULL;NULL;NULL;NULL;NULL;NULL;1;0;0;0;NULL;NULL;NULL;NULL;NULL;NULL;NULL
205;SAP;You have defined a classical screen (dynpro) with mandatory input fields. You want to exit the screen using the Cancel button even if not all of the mandatory fields have been filled. What is necessary to achieve this?Please choose the correct answer.;NULL;Set the function type assigned to the Cancel button to S and handle it in a module with the addition AT EXIT-COMMAND.;Assign function type E to the Cancel button and handle it in a module with the addition AT EXIT-COMMAND.;Set the function code assigned to the Cancel button to CANCEL and handle it in a module with the addition AT EXIT-COMMAND.;"Use the LOOP AT SCREEN. ... ENDLOOP statement to set the ""required"" property of the input fields to zero.";NULL;NULL;NULL;NULL;NULL;NULL;NULL;0;1;0;0;NULL;NULL;NULL;NULL;NULL;NULL;NULL
206;SAP;What can be part of the signature of an instance constructor?;2;Changing parameters;Exceptions;Exporting parameters;Importing parameters;NULL;NULL;NULL;NULL;NULL;NULL;NULL;0;1;0;1;NULL;NULL;NULL;NULL;NULL;NULL;NULL
207;SAP;When should you use a hashed internal table?;2;When accessing mainly single records;When accessing by secondary key;When accessing using the left-justified part of the key;When accessing always by primary key;When accessing by index;NULL;NULL;NULL;NULL;NULL;NULL;1;0;0;1;0;NULL;NULL;NULL;NULL;NULL;NULL
208;SAP;Where do you create online documentation ((F1) help) for fields on the screen?;1;Table;Structure;Field;Data element;Domain;NULL;NULL;NULL;NULL;NULL;NULL;0;0;0;1;0;NULL;NULL;NULL;NULL;NULL;NULL
209;SAP;What are the advantages of modularization?;3;Performance;Reusability;Profitability across DBMS;Maintainability;Transparency;NULL;NULL;NULL;NULL;NULL;NULL;0;1;0;1;1;NULL;NULL;NULL;NULL;NULL;NULL
210;SAP;You want to loop over an internal table without copying each table row to a work area. How can you achieve this using a field symbol?;1;LOOP ... INTO <field_symbol> TRANSPORTING ... ENDLOOP.;LOOP ...ASSIGNING <field_symbol> ...ENDLOOP.;LOOP ... REFERENCE INTO <field_symbol> ... ENDLOOP.;LOOP ...INTO <field_symbol> ...ENDLOOP.;NULL;NULL;NULL;NULL;NULL;NULL;NULL;0;1;0;0;NULL;NULL;NULL;NULL;NULL;NULL;NULL
211;SAP;You run an executable program that contains the following code:DATA: gv_var1 TYPE n LENGTH 3,Gv_var2 TYPE n LENGTH 3 VALUE 456.START-OF-SELECTIONCLEAR gv_var2Gv_var2 = gv_var1.Gv_var1 = 123.At what point does the system reserve memory for the data object gv_var1?;1;When value 123 is assigned to the data object;At the beginning of the START-OF-SELECTION event block;When the assignment to gv_var2 is executed;As soon as the program is loaded into the internal session;NULL;NULL;NULL;NULL;NULL;NULL;NULL;0;0;0;1;NULL;NULL;NULL;NULL;NULL;NULL;NULL
212;SAP;Which of the following ABAP dictionary types can you use to define domains?;3;FLOAT;NUMC;CHAR;DATE;DEC;NULL;NULL;NULL;NULL;NULL;NULL;0;1;1;0;1;NULL;NULL;NULL;NULL;NULL;NULL
213;SAP;Which of the following types of SQL statements always bypass the SAP table buffers?;2;SELECT SUM (sales);SELECT SINGLE;SELECT  UP TO 1 ROW;SELECT  INNER JOIN;NULL;NULL;NULL;NULL;NULL;NULL;NULL;1;0;0;1;NULL;NULL;NULL;NULL;NULL;NULL;NULL
214;SAP;Compared to a predefined ABAP type what additional properties can be assigned to a domain? ;3;Fixed values;Conversion exits;Value tables;Parameter IDs;Search helps;NULL;NULL;NULL;NULL;NULL;NULL;1;1;1;0;0;NULL;NULL;NULL;NULL;NULL;NULL
215;SAP;You are writing an ABAP declaration using the data element S_CARR_ID. Which of the following statements correctly define a data object?;2;DATA gv_id TYPE s_carr_id;DATA gv_id TYPE s_carr_id DEFAULT QF;DATA gv_id LIKE s_carr_id;CONSTANTS gc_qf TYPE s_carr_id VALUE QF;NULL;NULL;NULL;NULL;NULL;NULL;NULL;1;0;0;1;NULL;NULL;NULL;NULL;NULL;NULL;NULL
216;SAP;Which of the following data types are predefined ABAP data types?;3;DECFLOAT34;STRING;XSTRING;FLOAT;DECIMALS;NULL;NULL;NULL;NULL;NULL;NULL;1;1;1;0;0;NULL;NULL;NULL;NULL;NULL;NULL
217;SAP;You want to use a BAdI to extend the functions of an SAP program. Which of the following tasks is necessary?;1;Call the BAdI;Create an enhancement project using a customer exit.;Define an interface for the BAdI.;Implement a class that implements the BAdI interface.;NULL;NULL;NULL;NULL;NULL;NULL;NULL;0;0;0;1;NULL;NULL;NULL;NULL;NULL;NULL;NULL
218;SAP;can you search for suitable classic Business Add-Ins(BAdIs)?;2;Search for suitable entries in the relevant component in the Implementation Guide (IMG);Search in an application program for the method GET_INSTANCE of class CL_EXITHANDLER;Use the SAP menu Tools -> ABAP Workbench -> Development -> Business Object Builder;Search in the Repository Information System and choose Enhancements - >Customer Exits;NULL;NULL;NULL;NULL;NULL;NULL;NULL;1;1;0;0;NULL;NULL;NULL;NULL;NULL;NULL;NULL
219;SAP;What is the event block that all of your code changes belongs to if you do not explicitly code any event blocks in an executable program?;1;LOAD-OF-PROGRAM;START-OF-SELECTION;INITIALIZATION;AT SELECTION-SCREEN OUTPUT;NULL;NULL;NULL;NULL;NULL;NULL;NULL;0;1;0;0;NULL;NULL;NULL;NULL;NULL;NULL;NULL
220;SAP;The USER has the following fields: ID, FIRST_NAME, LAST_NAME. FIRST_NAME, LAST_NAME have the same basic type and length. You want to compare fields FIRST_NAME, LAST_NAME to each other.Which of the following SELECT statements can you use?;2;SELECT*FROM users INTO TABLE It_users;WHERE first name = users last_name.;SELECT*FROM users AS a INTO TABLE It_users;WHERE afirst_name = alast_name;SELECT*FROM users INTO TABLE It_users WHERE first_name = users last_name;SELECT*FROM users AS a INTO TABLE It_users WHERE a first_name = last_name.;NULL;NULL;NULL;NULL;NULL;1;0;1;0;0;0;NULL;NULL;NULL;NULL;NULL
221;SAP;Which statements are true regarding ABAP inheritance? ;4;You can access the superclass component with the prefix SUPER->.;The instance constructor can be overwritten as part of inheritance.;The static constructor can be overwritten as part of inheritance.;Overloading allows a method to have several definitions with different signatures.;Instance constructors must call the superclasss constructor.;Static constructors do not need to call the superclasss constructor.;Polymorphism requires the developer to specify which method to use with inheritance.;NULL;NULL;NULL;NULL;1;1;0;0;1;1;0;NULL;NULL;NULL;NULL
222;SAP;Which rules do you have to consider when working with pooled tables?;2;Only key fields should be used in WHERE condition;All fields can be used in indexes;An append structure can be created;Only key fields should be used in ORDER BY clauses;NULL;NULL;NULL;NULL;NULL;NULL;NULL;1;0;0;1;NULL;NULL;NULL;NULL;NULL;NULL;NULL
223;SAP;Which statements are true?;5;The ALV Grid uses a reference to the data table for display.;The ALV Object Model uses a reference to the data table for display.;The ALV Grid can define a sort criteria for initial display.;The ALV Object Model can define a sort criteria for initial display.;The ALV Grid requires a table refresh after programmatically changing the ALV.;The ALV Object Model requires a table refresh after programmatically changing the ALV.;NULL;NULL;NULL;NULL;NULL;1;1;1;1;1;0;NULL;NULL;NULL;NULL;NULL
224;SAP;Which components belong to an elementary search help?;2;Fixed values;Import / export parameters;Selection method;Attachment to a field;NULL;NULL;NULL;NULL;NULL;NULL;NULL;0;1;1;0;NULL;NULL;NULL;NULL;NULL;NULL;NULL
225;SAP;Which of the following transactions can you use to define transparent tables?;1;SE16N;SM37;SE11;SE38;NULL;NULL;NULL;NULL;NULL;NULL;NULL;0;0;1;0;NULL;NULL;NULL;NULL;NULL;NULL;NULL
226;SAP;When does the lifetime of a Web Dynpro component begin and end?;1;It begins when instantiated and it ends when the program ends or the object is freed.;It begins the first time it is called at runtime, and it ends with the Web Dynpro application that called and instantiated the component ends.;It begins each time it is called, and it ends when the component completes.;It ends each time it is called, and it ends when the component completes.;NULL;NULL;NULL;NULL;NULL;NULL;NULL;0;1;0;0;NULL;NULL;NULL;NULL;NULL;NULL;NULL
227;SAP;What is the maximum number of watchpoints that can exist at one time?;1;8;10;6;No limit;NULL;NULL;NULL;NULL;NULL;NULL;NULL;0;0;0;1;NULL;NULL;NULL;NULL;NULL;NULL;NULL
228;SAP;How can you maintain documentation for input fields on your screen?;1;Add documentation to the SCREEN table at PROCESS BEFORE OUTPUT (PBO).;Add documentation to the SCREEN table at PROCESS AFTER INPUT (PAI).;Add documentation to the underlying data element.;Define text tables for the underlying structure.;NULL;NULL;NULL;NULL;NULL;NULL;NULL;0;0;1;0;NULL;NULL;NULL;NULL;NULL;NULL;NULL
229;SAP;Which of the following is a true statement?;2;A sorted table can have a unique or a non-unique key.;A standard table should always have a unique key.;A hashed table should always have a unique table key.;A standard table should always have a multiple key.;NULL;NULL;NULL;NULL;NULL;NULL;NULL;1;0;1;0;NULL;NULL;NULL;NULL;NULL;NULL;NULL
